Название|Остаток|Бренд|Описание|Артикул|Цена|Старая цена|Категория
iphone|150|iphone|description|art1|129.46|148.29|phone
Samsung|150||Samsung descr||133.0|148.29|phone
product 1|23||||11.0|13.2|category 1
product 2|23||||24.0|26.4|category 1-1
product 3|23||||64.82|60.5|category 2
товар с импорта 1|1|самуснг|дескрипшн|вендор код|150.0|180.0|category 2;с импорта
товар с импорта 2|1|самуснг|дескрипшн|вендор код|160.0|190.0|с импорта;с импорта new
товар с импорта 3|0|самуснг|дескрипшн|вендор код|170.0|200.0|с импорта
товар с импорта 4|0|самуснг|дескрипшн|вендор код|180.0|210.0|с импорта
товар с импорта 5|0|самуснг|дескрипшн|вендор код|190.0|220.0|с импорта
товар с импорта 6|0|самуснг|дескрипшн|вендор код|200.0|230.0|с импорта
товар с импорта 7|0|самуснг|дескрипшн|вендор код|210.0|250.0|с импорта
товар с импорта 8|0|самуснг|дескрипшн|вендор код|220.0|260.0|с импорта new
товар с импорта 9|1|самуснг|дескрипшн|вендор код|220.0|260.0|с импорта new1
товар с импорта 10|0|самуснг|дескрипшн|вендор код|220.0|260.0|с импорта new2
digital file|0||||120.0|0.0|digit
Пылесос без мешка BOSCH BGS1K330|0|Bosch|||3199.0|4499.0|Пылесосы для сухой уборки
Машинка для стрижки волос PHILIPS QC5115/15|0|Philips|||699.0|839.0|Машинки для стрижки
Кофемашина KRUPS Evidence One EA895N10|0|Krups|||19999.0|33999.0|Кофеварки
Хлебопечка PANASONIC SD-ZB2502BTS|0|Panasonic|||5699.0|6399.0|Хлебопечки
Робот-пылесос ROWENTA Explorer Serie 80 RR7755|0|Rowenta|||11999.0|12999.0|Роботы-пылесосы
Триммер универсальный PHILIPS Series 3000 MG3740/15|0|Philips|||999.0|1099.0|Триммеры
Набор электрических зубных щеток PHILIPS Sonicare DiamondClean HX9392/39|0|Philips|||9399.0|12599.0|Зубные щетки и ирригаторы
Фотоэпилятор PHILIPS Lumea Advanced SC1997/00|0|Philips|||7599.0|9499.0|Фотоэпиляторы
Фен PHILIPS ThermoProtect Ionic HP8233/00|0|Philips|||1199.0|1199.0|Фены
Блендер TEFAL INFINY FORCE 3IN1 HB943838|0|Tefal|||1899.0|2399.0|Блендеры
Пульсоксиметр iMDK C101A2 Black|0|IMDK|||699.0|1099.0|Пульсоксиметры
Весы напольные RZTK BS 200B|0|RZTK|||299.0|349.0|Весы напольные
Фильтр для воды и против накипи Philips CA6903/10|0|Philips|||549.0|549.0|Аксессуары для кофеварок и кофемашин
Электробритва PHILIPS Series 5000 S5250/06|0|Philips|||2399.0|2999.0|Электробритвы
Щипцы для волос PHILIPS StraightCare BHS674/00|0|Philips|||1299.0|1299.0|Приборы для укладки волос
Миксер RZTK M 403|0|RZTK|||619.0|795.0|Миксеры
Пароварка TEFAL VC140131|0|Tefal|||1449.0|0.0|Пароварки
Утюг RZTK V3 Blade|0|RZTK|||479.0|545.0|Утюги и гладильные системы
Кухонная машина KENWOOD Chef KVC3170S|0|Kenwood|||11999.0|13999.0|Кухонные комбайны
Швейная машина JANOME Dress Code|0|Janome|||4999.0|5670.0|Швейные машинки
Мультимейкер RZTK SM 856A|0|RZTK|||1099.0|1099.0|Бутербродницы и вафельницы
Эпилятор PHILIPS Satinelle Essential BRE255/00|0|Philips|||799.0|999.0|Эпиляторы
Электрическая печь DEX DTO-450C|0|Dex|||2999.0|3349.0|Электрические печи
Ингалятор OMRON NE-C101 ESSENTIAL (NE-C101-E)|0|Omron|||1049.0|1192.0|Ингаляторы
Электрочайник TEFAL KO151130|0|Tefal|||659.0|849.0|Электрочайники
Тостер RZTK TSR 852|0|RZTK|||399.0|499.0|Тостеры
Кофемолка RZTK CG 256R|0|RZTK|||499.0|595.0|Кофемолки
Электропростынь BEURER TS 15|0|Beurer|||1699.0|0.0|Электропростыни
Щипцы для волос PHILIPS StraightCare Essential BHS375/00|0|Philips|||649.0|649.0|Приборы для укладки волос
Сушилка для овощей и фруктов DEX DFD-395S с металлическими лотками|0|Dex|||3999.0|4399.0|Сушилки для овощей и фруктов
Фритюрница CLATRONIC FFR2916|0|Clatronic|||1049.0|1049.0|Фритюрницы
Кислородная канюля Hitec Medical HTA0704 (Стандарт/2.1м)|0|Hitec Medical|||49.0|0.0|Запчасти и комплектующие к медтехнике
Кислородный концентратор Konsung KSOC-5 (5L)|0|Konsung|||16989.0|24999.0|Аппараты для дыхания и кислородной терапии
Блинница TEFAL PY900|0|Tefal|||3999.0|4699.0|Блинницы
Кислородная маска с трубкой Hitec Medical HTA0104 (Стандарт/2.5м)|0|Hitec Medical|||249.0|299.0|Запчасти и комплектующие к медтехнике
Электросушилка для обуви ДОМОВЕНОК Комфорт ЕС 12/220 с обработкой озоном|0|Домовенок|||440.0|499.0|Сушилки для обуви
Бесконтактный инфракрасный термометр Healthkeep CQ1201|0|Healthkeep|||899.0|1999.0|Термометры для тела
Электронный шагомер TFA Hitrax Walk (422003)|0|TFA|||326.0|449.0|Шагомеры
Кулер для воды HotFrost V1950N|0|HotFrost|||5180.0|5999.0|Кулеры для воды
Шоколадный фонтан CLATRONIC SKB3248|0|Clatronic|||1459.0|0.0|Прочая мелкая техника
Кулер для воды Cooper&Hunter CH-V127C|0|Cooper&Hunter|||4878.0|0.0|Кулеры для воды
Гриль TEFAL OptiGrill Elite GC750830|0|Tefal|||7499.0|10999.0|Грили и электрошашлычницы
Блендер Bosch MSM2650B|0|Bosch|||1399.0|1529.0|Блендеры
Смарт-весы Xiaomi Mi Body Composition Scales 2 XMTZC05HM (NUN4048GL)|0|Xiaomi|||899.0|999.0|Весы напольные
Триммер универсальный PHILIPS Series 5000 MG5730/15|0|Philips|||1599.0|1799.0|Триммеры
Мультиварка TEFAL Multicook & Grain RK900|0|Tefal|||3299.0|4699.0|Мультиварки
Микроволновая печь PANASONIC NN-ST251WZPE|0|Panasonic|||2799.0|2599.0|Микроволновые печи
Утюг PHILIPS EasySpeed Advanced GC2678/30|0|Philips|||1279.0|1599.0|Утюги и гладильные системы
Аккумуляторный пылесос ROWENTA Air Force 560 FLEX RH9479WO|0|Rowenta|||9999.0|11999.0|Аккумуляторные пылесосы
Миксер TEFAL Prep'Mix HT450B38|0|Tefal|||759.0|1399.0|Миксеры
Зеркало для макияжа Xiaomi Jordan Judy NV026 White с LED подсветкой (6971418388353)|0|Xiaomi|||499.0|659.0|Зеркала косметические
Эпилятор BRAUN SE 1370|0|Braun|||749.0|1099.0|Эпиляторы
Электрическая печь MIRTA Dalim Argento MO-0165X|0|Mirta|||3134.0|3499.0|Электрические печи
Фотоэпилятор BRAUN PL 3000|0|Braun|||6999.0|9899.0|Фотоэпиляторы
Кухонная машина TEFAL Masterchef Gourmet+ QB632|0|Tefal|||11999.0|16399.0|Кухонные комбайны
Мясорубка RZTK MM 1800K Plus|0|RZTK|||1999.0|2295.0|Мясорубки
Фен Rowenta Powerline CV5930F0|0|Rowenta|||799.0|899.0|Фены
Электрическая печь MIRTA MO-0145 R|0|Mirta|||2944.0|3299.0|Электрические печи
Машинка для стрижки волос ROWENTA TN 1600|0|Rowenta|||599.0|699.0|Машинки для стрижки
Электрочайник PHILIPS Daily Collection HD4646/00 Белый|0|Philips|||839.0|839.0|Электрочайники
Тонометр B.Well pro-35 с адаптером|0|B.Well|||1099.0|0.0|Тонометры
Вакуумный упаковщик ELECTROLUX E4VS1-4AG|0|Electrolux|||1788.0|2199.0|Бытовые вакуумные упаковщики
Электрическая печь MIRTA MO-0145 W|0|Mirta|||2849.0|3199.0|Электрические печи
Сушилка для овощей и фруктов WetAir FD-560|0|WetAir|||2299.0|2599.0|Сушилки для овощей и фруктов
Мультирезка TEFAL MB905834|0|Tefal|||5399.0|5999.0|Ломтерезки
Швейная машина JANOME TC 1218|0|Janome|||4299.0|4760.0|Швейные машинки
Хлебопечка PANASONIC SD-ZP2000KTS|0|Panasonic|||6399.0|6999.0|Хлебопечки
Электропростынь BEURER TS 19|0|Beurer|||1519.0|1899.0|Электропростыни
Мультимейкер RUSSELL HOBBS Fiesta 24540-56|0|Russell Hobbs|||1699.0|1899.0|Бутербродницы и вафельницы
Машинка для стрижки катышков PHILIPS Fabric Shaver GC026/30 Pink (8710103661375)|0|Philips|||399.0|399.0|Машинки для стрижки катышков
Пульсоксиметр профессиональный General Meditech G1B plus|0|General Meditech|||8960.0|0.0|Пульсоксиметры
Ингалятор GAMMA Effect Max|0|Гамма|||735.0|0.0|Ингаляторы
Швейная машина JANOME E-Line 15|0|Janome|||3790.0|0.0|Швейные машинки
Соковыжималка для цитрусовых MAGIO MG-189|0|Magio|||859.0|899.0|Соковыжималки
Электросушка для обуви Supretto Осень 3 (B015-0001)|0|Supretto|||199.0|0.0|Сушилки для обуви
Облучатель бактерицидный кварцевый ЗАВЕТ ОБН-8Н|0|Завет|||520.0|0.0|Бактерицидные облучатели
Яйцеварка STEBA EK 5|0|Steba|||1399.0|1566.0|Яйцеварки
Лампа ESPERANZA UV Lamp EBN001W для полимеризации|0|Esperanza|||299.0|329.0|Лампы для маникюра
Электростимулятор BEURER EM 37|0|Beurer|||2629.0|0.0|Массажеры
Фритюрница STEBA DF 90|0|Steba|||1463.0|0.0|Фритюрницы
Кулер для воды HotFrost V250CE Gold|0|HotFrost|||4340.0|5999.0|Кулеры для воды
Облучатель-рециркулятор бактерицидный ЗАВЕТ АЭРЭКС-СТАНДАРТ 15|0|Завет|||3500.0|0.0|Бактерицидные облучатели
Облучатель бактерицидный кварцевый ЗАВЕТ ОБН-35Н|0|Завет|||1499.0|0.0|Бактерицидные облучатели
Облучатель-рециркулятор бактерицидный ЗАВЕТ АЭРЭКС-СТАНДАРТ 30|0|Завет|||3120.0|3120.0|Бактерицидные облучатели
Облучатель-рециркулятор бактерицидный ЗАВЕТ АЭРЭКС-СТАНДАРТ 30 (Черный)|0|Завет|||3995.0|0.0|Бактерицидные облучатели
Кулер для воды FAMILY WBF-1000LA черный|0|Family|||6669.0|0.0|Кулеры для воды
Гриль TEFAL OptiGrill+ GC712D34|0|Tefal|||5799.0|6999.0|Грили и электрошашлычницы
Робот-пылесос Xiaomi RoboRock S5 Max White (S5E02-00) (Международная версия)|0|Xiaomi|||12999.0|13999.0|Роботы-пылесосы
Фен BABYLISS 6709DE АС motor PRO|0|BaByliss|||1099.0|1399.0|Фены
Электрочайник TEFAL Loft KO250130|0|Tefal|||899.0|1199.0|Электрочайники
Микроволновая печь SAMSUNG ME81MRTS/BW|0|Samsung|||2399.0|2799.0|Микроволновые печи
Фотоэпилятор PHILIPS Lumea Advanced SC1994/00|0|Philips|||6499.0|7999.0|Фотоэпиляторы
Машинка для стрижки катышков PHILIPS Fabric Shaver GC026/00 Blue (8710103660774)|0|Philips|||399.0|0.0|Машинки для стрижки катышков
Пылесос без мешка ROWENTA X-Trem Power Cyclonic RO6984EA 4AAAA Ecomotor|0|Rowenta|||4999.0|5999.0|Пылесосы для сухой уборки
Кофемашина DELONGHI PrimaDonna S Evo ECAM 510.55.M|0|Delonghi|||25999.0|29999.0|Кофеварки
Утюг Tefal Virtuo FV1710|0|Tefal|||599.0|649.0|Утюги и гладильные системы
Электробритва PHILIPS Shaver Series 1000 S1133/41|0|Philips|||999.0|999.0|Электробритвы
Электрическая печь DEX DTO-600CA|0|Dex|||3799.0|3949.0|Электрические печи
Соковыжималка центробежная PHILIPS Avance Collection HR1922/20|0|Philips|||5299.0|6299.0|Соковыжималки
Машинка для стрижки катышков RZTK LR 3 white|0|RZTK|||149.0|169.0|Машинки для стрижки катышков
Соковыжималка центробежная PHILIPS Viva Compact HR1832/02|0|Philips|||2599.0|2999.0|Соковыжималки
Швейная машина MINERVA M832B|0|Minerva|||3599.0|3999.0|Швейные машинки
Ингалятор LITTLE DOCTOR LD-221C|0|Little Doctor|||883.0|989.0|Ингаляторы
Набор для стрижки BRAUN MGK3245 + бритва Gillette|0|Braun|||999.0|1299.0|Триммеры
Мясорубка RZTK MM 1700|0|RZTK|||1099.0|1245.0|Мясорубки
Сушилка для овощей и фруктов RZTK DFV 405|0|RZTK|||899.0|1099.0|Сушилки для овощей и фруктов
Тонометр GAMMA Optima|0|Гамма|||675.0|0.0|Тонометры
Кухонная машина KENWOOD MultiOne KHH326WH|0|Kenwood|||9999.0|13999.0|Кухонные комбайны
Эпилятор Philips 8000 series BRE710/00|0|Philips|||2199.0|2199.0|Эпиляторы
Мультиварка PHILIPS Viva Collection HD3136/03|0|Philips|||2199.0|2999.0|Мультиварки
Вакуумный упаковщик PROFI COOK PC-VK 1134|0|Profi Cook|||3456.0|0.0|Бытовые вакуумные упаковщики
Миксер BOSCH MFQ2210D|0|Bosch|||899.0|1199.0|Миксеры
Тостер BOSCH TAT4P420|0|Bosch|||1759.0|0.0|Тостеры
Машинка для стрижки волос PHILIPS HC3510/15|0|Philips|||669.0|669.0|Машинки для стрижки
Весы кухонные ESPERANZA EKS001|0|Esperanza|||237.0|339.0|Весы кухонные
Мультимейкер DELONGHI MultiGrill Easy SW12AC.S|0|Delonghi|||2599.0|2599.0|Бутербродницы и вафельницы
Кислородная подушка PECHAM 42 л (0009119080125)|0|Pecham|||399.0|599.0|Аппараты для дыхания и кислородной терапии
Соковыжималка шнековая SCARLETT SC-JE50S46|0|Scarlett|||1699.0|1999.0|Соковыжималки
Аппарат для приготовления попкорна RUSSELL HOBBS Fiesta 24630-56|0|Russell Hobbs|||1199.0|0.0|Прочая мелкая техника
Мультипечь TEFAL Fry Delight FX100|0|Tefal|||5499.0|6199.0|Мультипечи и аэрогрили
Термометр OMRON Flex Temp Smart (МС-343-F-Е)|0|Omron|Тип термометра: электронный. Область измерения температуры: аксиллярная, оральная, ректальная. Диапазон измерений температуры: 32-42 °C. Погрешность ±: 0,1 °С. Длительность измерения температуры: от 10 сек. до 300 сек.||432.0|0.0|Термометры для тела
Кулер для воды COOPER&HUNTER H1-TER|0|Cooper&Hunter|||2565.0|0.0|Кулеры для воды
Облучатель бактерицидный BACTOSFERA OBB 15P OZONE FREE/OSRAM (4820174361112)|0|BactoSfera|||833.0|0.0|Бактерицидные облучатели
Кофемолка VITEK VT-7124 BK|0|Vitek|||430.0|0.0|Кофемолки
Вакуумный очиститель пор лица Protech Blackhead C2017-01 (PB-0706)|0|Protech|||369.0|599.0|Косметические приборы
Кофемолка MAGIO MG-208|0|Magio|||649.0|649.0|Кофемолки
Набор для маникюра и педикюра BABYLISS 8480E|0|BaByliss|||1199.0|1899.0|Фрезеры для маникюра и педикюра
Йогуртница-сыроварка CUISINART YM400E|0|Cuisinart|||1999.0|0.0|Йогуртницы
Цифровой электростимулятор BEURER EM 38|0|Beurer|||2889.0|0.0|Массажеры
Яйцеварка-пароварка CASO ED10|0|Caso|||1670.0|0.0|Яйцеварки
Пылесос без мешка BOSCH BGC05AAA1|0|Bosch|||2199.0|3299.0|Пылесосы для сухой уборки
Гриль TEFAL OptiGrill+ GC716|0|Tefal|||6999.0|8999.0|Грили и электрошашлычницы
Моющий пылесос с аквафильтром BOSCH BWD41700|0|Bosch|||4999.0|6499.0|Моющие пылесосы
Робот-пылесос ROWENTA Explorer Serie 60 RR7447|0|Rowenta|||7799.0|8599.0|Роботы-пылесосы
Тонометр  OMRON M2 Basic (HEM 7121–ALRU)|0|Omron|||1736.0|0.0|Тонометры
Электрическая зубная щетка ORAL-B BRAUN Stage Power/D100 Frozen (4210201245216)|0|Oral-b Braun|||529.0|679.0|Зубные щетки и ирригаторы
Утюг с парогенератором Philips PerfectCare Compact GC7833/80|0|Philips|||3999.0|5999.0|Утюги и гладильные системы
Фен-щетка BABYLISS AS200E|0|BaByliss|||1899.0|2199.0|Приборы для укладки волос
Мясорубка MOULINEX 3в1 ME111032|0|Moulinex|||1699.0|2199.0|Мясорубки
Фен PHILIPS DryCare Essential BHD030/00|0|Philips|||759.0|759.0|Фены
Электрочайник RZTK KS 2217|0|RZTK|||499.0|645.0|Электрочайники
Швейная машина JANOME JQ2515s|0|Janome|||3799.0|4620.0|Швейные машинки
Кухонная машина BOSCH MUM54R00|0|Bosch|||6599.0|6599.0|Кухонные комбайны
Машинка для стрижки волос PHILIPS HC3505/15|0|Philips|||599.0|599.0|Машинки для стрижки
Эпилятор PHILIPS Satinelle Essential BRE225/00|0|Philips|||649.0|799.0|Эпиляторы
Весы напольные TEFAL Premiss PP1400V0|0|Tefal|||449.0|599.0|Весы напольные
Ингалятор OMRON NE–C28P (NE-28P-E)|0|Omron|||1999.0|0.0|Ингаляторы
Весы кухонные RZTK KS 5BS|0|RZTK|||319.0|395.0|Весы кухонные
Настольная плита Ardesto ICS-B218|0|Ardesto|||2599.0|2799.0|Настольные плиты
Сушилка для овощей и фруктов HAUSLICH DH 70419|0|Hauslich|||2399.0|2599.0|Сушилки для овощей и фруктов
Тостер RZTK TSR 802|0|RZTK|||389.0|489.0|Тостеры
Таблетки для удаления накипи Siemens TZ80002A|0|Siemens|||499.0|499.0|Аксессуары для кофеварок и кофемашин
Мультиварка-скороварка RZTK РC 105S Led|0|RZTK|||2899.0|3199.0|Мультиварки
Миксер PHILIPS Viva Collection HR3740/00|0|Philips|||1199.0|0.0|Миксеры
Термометр OMRON Eco Temp Basic (MC-246-E)|0|Omron|Тип термометра: электронный. Область измерения температуры: аксиллярная, оральная, ректальная. Диапазон измерений температуры: 32-42 °C. Погрешность ±: 0,1 °С. Длительность измерения температуры: от 60 сек. до 300 сек.||246.0|0.0|Термометры для тела
Мультипекарь REDMOND RMB-616/3-U|0|Redmond|||1299.0|1699.0|Бутербродницы и вафельницы
Электропростынь BEURER TS 26|0|Beurer|||2669.0|3339.0|Электропростыни
Электробритва Philips Shaver series 5000 S5585/30|0|Philips|||4499.0|4499.0|Электробритвы
Кофемолка MAGIO MG-202|0|Magio|||515.0|599.0|Кофемолки
Фотоэпилятор LUNA (INSPIRE) с функцией Ice Cool 500тыс. вспышек|0|Inspire|||3299.0|3999.0|Фотоэпиляторы
Массажная подушка BEURER MG 149|0|Beurer|||3779.0|3779.0|Массажеры
Шоколадный фонтан ARIETE 2962|0|Ariete|||1399.0|0.0|Прочая мелкая техника
Зеркало для макияжа Xiaomi DOCO Daylight Mirror White HZJ001|0|Xiaomi|||899.0|999.0|Зеркала косметические
Мультипечь TEFAL Ultimate Fry XL FX202|0|Tefal|||8099.0|8999.0|Мультипечи и аэрогрили
Электроодеяло SHINE ЕКВ-2/220 (165x150 см)|0|Shine|||849.0|0.0|Электроодеяла
Машинка для стрижки катышков TEFAL JB1011E0|0|Tefal|||379.0|449.0|Машинки для стрижки катышков
Электрическая грелка BEURER HK Comfort|0|Beurer|||1279.0|1599.0|Электрогрелки
Кулер для воды HOTFROST D65EN|0|HotFrost|||1932.0|0.0|Кулеры для воды
Хлебопечка KENWOOD BM 450|0|Kenwood|||6199.0|7199.0|Хлебопечки
Кулер для воды COOPER&HUNTER CH-V122F|0|Cooper&Hunter|||2295.0|2619.0|Кулеры для воды
Вакуумный упаковщик PROFI COOK PC-VK 1080|0|Profi Cook|||2499.0|0.0|Бытовые вакуумные упаковщики
Пароварка RUSSELL HOBBS MaxiCook 23560-56|0|Russell Hobbs|||2412.0|2799.0|Пароварки
Кофемолка DELONGHI KG 49|0|Delonghi|||1299.0|1899.0|Кофемолки
Кофемолка MAGIO MG-200 red|0|Magio|||479.0|569.0|Кофемолки
Яйцеварка CLATRONIC EK3497|0|Clatronic|||554.0|570.0|Яйцеварки
Лампа ESPERANZA UV LED Lamp EBN008 для полимеризации|0|Esperanza|||349.0|479.0|Лампы для маникюра
Кулер для воды FAMILY WBF-1000LA Серый|0|Family|||6049.0|0.0|Кулеры для воды
Пылесос без мешка ROWENTA Compact Power XXL RO4881EA|0|Rowenta|||3299.0|3999.0|Пылесосы для сухой уборки
Электрическая зубная щетка PHILIPS Sonicare HX6212/90|0|Philips|||2199.0|0.0|Зубные щетки и ирригаторы
Робот-пылесос ECOVACS DEEBOT OZMO 900 White|0|Ecovacs|||7999.0|11999.0|Роботы-пылесосы
Кофемашина PHILIPS Series 1200 EP1224/00|0|Philips|||10999.0|12999.0|Кофеварки
Микроволновая печь SAMSUNG ME83KRW-1/BW|0|Samsung|||2799.0|2999.0|Микроволновые печи
Блендер RZTK TB 1200|0|RZTK|||999.0|1195.0|Блендеры
Электробритва BRAUN Series 5 MBS5 MaxBraun (TYPE 5762 100лет)|0|Braun|||2599.0|3799.0|Электробритвы
Весы напольные RZTK BS 200S|0|RZTK|||299.0|349.0|Весы напольные
Кофемолка RZTK CG 355R|0|RZTK|||399.0|495.0|Кофемолки
Утюг с парогенератором TEFAL PRO EXPRESS ULTIMATE GV9620|0|Tefal|||10999.0|14999.0|Утюги и гладильные системы
Щипцы для волос PHILIPS StraightCare Essential BHS378/00|0|Philips|||999.0|999.0|Приборы для укладки волос
Миксер RZTK M 405|0|RZTK|||599.0|695.0|Миксеры
Гриль DELONGHI MultiGrill CGH1030D|0|Delonghi|||8499.0|10499.0|Грили и электрошашлычницы
Триммер RZTK TR 12|0|RZTK|||299.0|345.0|Триммеры
Эпилятор BRAUN Silk epil 7 SES 7/700 SensoSmart|0|Braun|||2299.0|3399.0|Эпиляторы
Мультиварка RZTK МC 105S Plus|0|RZTK|||2099.0|2099.0|Мультиварки
Дарсонваль GEZATONE BIOLIFT4 203 Pink|0|Gezatone|||1999.0|0.0|Дарсонваль и насадки
Электрочайник Philips HD9318/20|0|Philips|||799.0|949.0|Электрочайники
Машинка для стрижки волос PHILIPS Hairclipper series 3000 HC3522/15|0|Philips|||849.0|849.0|Машинки для стрижки
Фен PHILIPS DryCare BHD274/00|0|Philips|||1499.0|1499.0|Фены
Кофемолка MAGIO MG-206|0|Magio|||489.0|589.0|Кофемолки
Картридж BRAUN Clean&Renew CCR2|0|Braun|||499.0|499.0|Аксессуары к товарам по уходу за телом
Кухонная машина BOSCH MUMS2AW00|0|Bosch|||4099.0|4099.0|Кухонные комбайны
Лампа SUN LED+UV 5 PINK 48W для полимеризации|0|SUN|||299.0|399.0|Лампы для маникюра
Соковыжималка шнековая PHILIPS Avance Collection HR1945/80|0|Philips|||7599.0|8999.0|Соковыжималки
Ванночка для ног BEURER FB 20|0|Beurer|||1599.0|1999.0|Массажеры
Мультипекарь REDMOND RMB-M6011-U|0|Redmond|||1599.0|1699.0|Бутербродницы и вафельницы
Электрочайник Philips Series 3000 HD9318/00|0|Philips|||799.0|949.0|Электрочайники
Соковыжималка центробежная ARDESTO JEG-1000|0|Ardesto|||999.0|1699.0|Соковыжималки
Швейная машина MINERVA M819B|0|Minerva|||3579.0|0.0|Швейные машинки
