Название|Остаток|Бренд|Описание|Артикул|Цена|Старая цена|Категория
Сеточка для бритв PANASONIC WES9175Y1361|0|Panasonic|||1404.0|1499.0|Аксессуары к товарам по уходу за телом
Сеточка для бритв PANASONIC WES9085Y1361|0|Panasonic|||599.0|0.0|Аксессуары к товарам по уходу за телом
Пароварка SATURN ST-EC1184|0|Saturn|||399.0|455.0|Пароварки
Яйцеварка STEBA EK 4|0|Steba|||679.0|759.0|Яйцеварки
Соковыжималка для цитрусов Haeger HG-621(6971399024929)|0|Haeger|||1617.0|1703.0|Соковыжималки
Облучатель-рециркулятор бактерицидный ECOLINE Air 15|0|Ecoline|||2999.0|0.0|Бактерицидные облучатели
Электрическая грелка для ног BEURER FWM 50|0|Beurer|||2199.0|0.0|Электрогрелки
Мультиварка-скороварка MOULINEX CE501134|0|Moulinex|||2999.0|3999.0|Мультиварки
Гладильная система TEFAL IXEO POWER QT2020|0|Tefal|||11999.0|15399.0|Утюги и гладильные системы
Набор электрических зубных щеток ORAL-B Braun PRO 1 / 790 x2 Black (4210201298489)|0|Oral-b Braun|||1599.0|2229.0|Зубные щетки и ирригаторы
Гриль TEFAL OptiGrill Elite XL GC760D30|0|Tefal|||10999.0|12999.0|Грили и электрошашлычницы
Пылесос без мешка BOSCH BGS2POW1|0|Bosch|||5199.0|5399.0|Пылесосы для сухой уборки
Триммер (набор для стрижки) BRAUN MBMGK7 MaxBraun (TYPE 5544 100лет)|0|Braun|||2099.0|2699.0|Триммеры
Мясорубка BOSCH MFW2517W|0|Bosch|||2999.0|3899.0|Мясорубки
Тонометр MICROLIFE BP B1 Classic|0|Microlife|||805.0|1012.0|Тонометры
Электрочайник TEFAL KO 854830|0|Tefal|||1699.0|2499.0|Электрочайники
Электрическая зубная щетка ORAL-B Braun Genius 8000 Silver (4210201277361)|0|Oral-b Braun|||3999.0|5199.0|Зубные щетки и ирригаторы
Электрическая зубная щетка Philips ProtectiveClean 5100 HX6859/68|0|Philips|||3699.0|4199.0|Зубные щетки и ирригаторы
Форма для выпечки TEFAL Optigrill+ XA725870|0|Tefal|||1649.0|2099.0|Аксессуары для электрогрилей
Электробритва PHILIPS Shaver Series 1000 S1231/41|0|Philips|||1149.0|1349.0|Электробритвы
Фен Philips ThermoProtect HP8238/10|0|Philips|||999.0|999.0|Фены
Весы кухонные SCARLETT SC-KS57P21|0|Scarlett|||219.0|0.0|Весы кухонные
Электрическая печь PANASONIC NU-SC300BZPE|0|Panasonic|||17499.0|17499.0|Электрические печи
Тонометр Longevita BP-102|0|Longevita|||610.0|0.0|Тонометры
Эпилятор BRAUN SE 3170|0|Braun|||999.0|1399.0|Эпиляторы
Миксер BOSCH MFQ3540|0|Bosch|||1699.0|2049.0|Миксеры
Электрическая зубная щетка PHILIPS Sonicare EasyClean HX6511/50|0|Philips|||1499.0|0.0|Зубные щетки и ирригаторы
Кухонная машина KENWOOD Chef Sense KVC5100T|0|Kenwood|||12999.0|15999.0|Кухонные комбайны
Блендер PHILIPS Viva Collection HR2621/90|0|Philips|||1999.0|1999.0|Блендеры
Ингалятор OMRON A3 Complete (NE-C300-E)|0|Omron|||2777.0|0.0|Ингаляторы
Машинка для стрижки волос Babyliss E756E|0|BaByliss|||599.0|749.0|Машинки для стрижки
Фотоэпилятор ELLESILK IPL white|0|Inspire|||4499.0|6999.0|Фотоэпиляторы
Кулер для воды COOPER&HUNTER CH-V950B|0|Cooper&Hunter|||5886.0|0.0|Кулеры для воды
Тонометр VEGA VМ-210|0|VEGA|||354.0|0.0|Тонометры
Бритвенная головка PHILIPS SH30/50|0|Philips|||999.0|999.0|Аксессуары к товарам по уходу за телом
Ингалятор VEGA CN-01 W Family|0|VEGA|||1063.0|0.0|Ингаляторы
Зеркало косметическое BABYLISS 8438Е LED 8Х/1Х|0|BaByliss|||1799.0|2399.0|Зеркала косметические
Массажер BEURER MG 100|0|Beurer|||4199.0|5059.0|Массажеры
Шоколадный фонтан SUPRETTO C242|0|Supretto|||699.0|0.0|Прочая мелкая техника
Робот-пылесос 360 PLUS Vacuum Cleaner S6 White|0|360 Plus|||7999.0|10399.0|Роботы-пылесосы
Кофемолка ARIETE 3016|0|Ariete|||699.0|859.0|Кофемолки
Бутербродница RUSSELL HOBBS 24520-56|0|Russell Hobbs|||819.0|819.0|Бутербродницы и вафельницы
Электропростынь BEURER UB 90|0|Beurer|||4499.0|0.0|Электропростыни
Яйцеварка SEVERIN EK 3051|0|Severin|||691.0|869.0|Яйцеварки
Робот-пылесос XIAOMI RoboRock S6 Pure Vacuum Cleaner Black (S6P52-00)|0|Xiaomi|||10499.0|12999.0|Роботы-пылесосы
Гриль TEFAL OptiGrill+ XL GC724D12|0|Tefal|||9999.0|10999.0|Грили и электрошашлычницы
Утюг с парогенератором TEFAL Express Compact SV7112|0|Tefal|||2999.0|3949.0|Утюги и гладильные системы
Тонометр OMRON M2 Basic с адаптером (HEM-7121- ARU)|0|Omron|||1572.0|0.0|Тонометры
Миксер RZTK M 505|0|RZTK|||429.0|495.0|Миксеры
Мультиварка-скороварка REDMOND RMC-PM503|0|Redmond|||2699.0|3999.0|Мультиварки
Электробритва Philips Shaver 3000 S3232/52|0|Philips|||2299.0|2299.0|Электробритвы
Машинка для стрижки волос PHILIPS Hairclipper series 7000 HC7650/15|0|Philips|||1999.0|1999.0|Машинки для стрижки
Электрочайник PHILIPS Viva Collection HD9355/90|0|Philips|||1699.0|1699.0|Электрочайники
Фен PHILIPS Professional  HPS910/00|0|Philips|||1699.0|1799.0|Фены
Блендер Bosch MS6CA4120|0|Bosch|||1549.0|1699.0|Блендеры
Бутербродница RZTK SM 752A|0|RZTK|||355.0|355.0|Бутербродницы и вафельницы
Йогуртница GORENJE JM20W|0|Gorenje|||579.0|0.0|Йогуртницы
Эпилятор BRAUN Silk epil 5 SES 5/620 SensoSmart|0|Braun|||2399.0|2799.0|Эпиляторы
Тостер MAGIO MG-272Y|0|Magio|||499.0|0.0|Тостеры
Триммер ROWENTA SELECTIUM TN9440F4|0|Rowenta|||1899.0|2499.0|Триммеры
Форма для выпечки TEFAL Optigrill+ XL XA726870|0|Tefal|||2299.0|2999.0|Аксессуары для электрогрилей
Весы диагностические TEFAL BODY UP BM2520|0|Tefal|||649.0|899.0|Весы напольные
Фотоэпилятор BRAUN Silk-expert Pro 3 PL 3011|0|Braun|||7999.0|9999.0|Фотоэпиляторы
Электрическая грелка BEURER HK 44|0|Beurer|||1359.0|1699.0|Электрогрелки
Триммер для носа Xiaomi ShowSee Nose Hair Trimmer C1-BK Black (6972615042017)|0|Xiaomi|||259.0|399.0|Триммеры
Ингалятор LITTLE DOCTOR LD-212С (8887786800411)|0|Little Doctor|||1070.0|1260.0|Ингаляторы
Электропростынь Теплый пан ЕКН-2/220 (970х670)|0|Теплий Пан|||369.0|0.0|Электропростыни
Робот-пылесос iRobot Braava Jet М6|0|iRobot|||14999.0|18799.0|Роботы-пылесосы
Швейная машина JANOME JUNO 513|0|Janome|||3999.0|4290.0|Швейные машинки
Весы кухонные BEURER KS 19 Love|0|Beurer|||629.0|789.0|Весы кухонные
Электрическая печь Beko BMF30W|0|Beko|||4299.0|0.0|Электрические печи
Швейная машина MINERVA Next 141D|0|Minerva|||3719.0|0.0|Швейные машинки
Кофемолка VEGAS VCG-0044R|0|Vegas|||299.0|349.0|Кофемолки
Кухонная машина KENWOOD Prospero KHC29.H0BK|0|Kenwood|||12499.0|12499.0|Кухонные комбайны
Зеркало косметическое Xiaomi Jordan Judy Handheld Light Mirror Silver|0|Xiaomi|||499.0|599.0|Зеркала косметические
Сушилка для овощей и фруктов SENCOR SFD 6600BK|0|Sencor|||5199.0|0.0|Сушилки для овощей и фруктов
Кулер для воды HOTFROST D75Е|0|HotFrost|||1988.0|1988.0|Кулеры для воды
Ломтерезка Caso CR4 Acid Etched|0|Caso|||3995.0|0.0|Ломтерезки
Электроодеяло BEURER HD 90|0|Beurer|||3749.0|0.0|Электроодеяла
Аккумуляторный пылесос ROWENTA X-FORCE 11.60 AQUA RH9890|0|Rowenta|||12999.0|14999.0|Аккумуляторные пылесосы
Сменная панель TEFAL Optigrill+ XA723812|0|Tefal|||2299.0|2499.0|Аксессуары для электрогрилей
Гриль TEFAL OptiGrill+ XL GC722D34|0|Tefal|||8499.0|8999.0|Грили и электрошашлычницы
Эпилятор BRAUN Silk epil 9 SES 9/700 SensoSmart|0|Braun|||2699.0|3799.0|Эпиляторы
Блендер TEFAL BLENDFORCE BL420131|0|Tefal|||1099.0|1599.0|Блендеры
Триммер универсальный Philips Multigroom и OneBlade «12-в-1» MG9710/90|0|Philips|||3599.0|3599.0|Триммеры
Тостер PHILIPS Viva Collection HD2650/80|0|Philips|||1499.0|0.0|Тостеры
Фен PHILIPS DryCare Prestige HP8281/00|0|Philips|||2599.0|2599.0|Фены
Микроволновая печь BEKO MGF20210X|0|Beko|||2649.0|3299.0|Микроволновые печи
Мясорубка Moulinex ME620132|0|Moulinex|||3499.0|3999.0|Мясорубки
Миксер BOSCH MFQ4020|0|Bosch|||2049.0|0.0|Миксеры
Мороженица PROFI COOK PC-ICM 1140|0|Profi Cook|||1949.0|0.0|Мороженицы
Машинка для стрижки волос BRAUN HairClip HC5030|0|Braun|||1529.0|1799.0|Машинки для стрижки
Триммер Philips Beardtrimmer Series 5000 BT5502/15|0|Philips|||1549.0|1549.0|Триммеры
Бритвенная головка PHILIPS Shaver series 9000 SH90/70|0|Philips|||1999.0|1999.0|Аксессуары к товарам по уходу за телом
Аппарат для приготовления сладкой ваты SUPRETTO 4479|0|Supretto|||699.0|0.0|Прочая мелкая техника
Сушилка для овощей и фруктов Hölmer HFD-52W|0|Hölmer|||949.0|1059.0|Сушилки для овощей и фруктов
Ингалятор VEGA CN-02 WX Samy|0|VEGA|||793.0|1183.0|Ингаляторы
Электробритва PHILIPS Shaver Series 3000 S3333/54|0|Philips|||2499.0|0.0|Электробритвы
Весы кухонные MAGIO MG-792|0|Magio|||265.0|279.0|Весы кухонные
Прибор для очищения лица PHILIPS VisaPure BSC111/06|0|Philips|||1299.0|1299.0|Косметические приборы
Электропростынь BEURER UB 53|0|Beurer|||2369.0|2969.0|Электропростыни
Лампа ESPERANZA UV Lamp EBN003W для полимеризации|0|Esperanza|||164.0|199.0|Лампы для маникюра
Соковыжималка для цитрусовых BRAUN CJ3000WH|0|Braun|||699.0|1099.0|Соковыжималки
Кулер для воды HOTFROST V115С|0|HotFrost|||4900.0|4900.0|Кулеры для воды
Отпариватель RZTK Steam Blast|0|RZTK|||569.0|665.0|Утюги и гладильные системы
Микроволновая печь SAMSUNG ME83KRS-1/BW|0|Samsung|||2799.0|2999.0|Микроволновые печи
Мультиварка-скороварка MOULINEX Quickchef CE430832|0|Moulinex|||3999.0|4199.0|Мультиварки
Мясорубка BOSCH MFW3600W|0|Bosch|||2259.0|2599.0|Мясорубки
Эпилятор BRAUN SЕ 7561 8-в-1|0|Braun|||2999.0|3799.0|Эпиляторы
Кофемашина SAECO Lirika Plus Cappuccino10004477|0|Saeco|||9756.0|11999.0|Кофеварки
Триммер для тела PHILIPS Series 3000 BG3010/15|0|Philips|||999.0|999.0|Триммеры
Миксер BOSCH MFQ3010|0|Bosch|||699.0|849.0|Миксеры
Набор для укладки Rowenta Unlimited looks CF4132|0|Rowenta|||1599.0|0.0|Приборы для укладки волос
Тонометр MICROLIFE BP A200 AFIB|0|Microlife|||1690.0|1961.0|Тонометры
Электробритва Philips Shaver S9000 Prestige SP9860/13|0|Philips|||10999.0|10999.0|Электробритвы
Стайлер PHILIPS MoistureProtect HP8374/00|0|Philips|||2999.0|2999.0|Приборы для укладки волос
Машинка для стрижки волос REMINGTON HC5035|0|Remington|||649.0|849.0|Машинки для стрижки
Сушилка для овощей и фруктов SENCOR SFD 7000BK с металлическими лотками|0|Sencor|||5499.0|0.0|Сушилки для овощей и фруктов
Сушилка для овощей и фруктов PROFITM ЕСП-01 Черный 35 л (PM20217003)|0|Profit M|||2149.0|0.0|Сушилки для овощей и фруктов
Смарт-весы SCARLETT SC-BS33ED47|0|Scarlett|||549.0|549.0|Весы напольные
Тонометр B.Well MED-55|0|B.Well|||1099.0|1379.0|Тонометры
Фотоэпилятор BRAUN Silk-expert Pro 3 PL 3132|0|Braun|||8999.0|11499.0|Фотоэпиляторы
Электрочайник TEFAL KI150D30|0|Tefal|||999.0|1199.0|Электрочайники
Гриль DELONGHI MultiGrill CGH1012D.SP|0|Delonghi|||6599.0|7999.0|Грили и электрошашлычницы
Яйцеварка CASO E7|0|Caso|||1664.0|1895.0|Яйцеварки
Фитнес-блендер RZTK SB 3560|0|RZTK|||499.0|695.0|Блендеры
Сменная панель DELONGHI DLSK151|0|Delonghi|||1279.0|2299.0|Аксессуары для электрогрилей
Тостер GRUNHELM GWD008|0|Grunhelm|||309.0|0.0|Тостеры
Кулер для воды HOTFROST V115CE|0|HotFrost|||3220.0|3278.0|Кулеры для воды
Бритвенная головка PHILIPS DualPrecision RQ11/50|0|Philips|||1699.0|1699.0|Аксессуары к товарам по уходу за телом
Электрическая печь DEX DTO-1005 CA|0|Dex|||4999.0|5599.0|Электрические печи
Ингалятор LITTLE DOCTOR LD-250U|0|Little Doctor|||1680.0|0.0|Ингаляторы
Кулер для воды HOTFROST 35AEN|0|HotFrost|||7560.0|7695.0|Кулеры для воды
Массажер BEURER MG 40|0|Beurer|||1149.0|0.0|Массажеры
Мороженица PROFI COOK PC-ICM 1091|0|Profi Cook|||12099.0|0.0|Мороженицы
Соковыжималка шнековая ARIETE 177/1|0|Ariete|||3695.0|4459.0|Соковыжималки
Кухонная машина TEFAL Masterchef Gourmet QB515|0|Tefal|||9999.0|11699.0|Кухонные комбайны
Прибор для удаления ушной серы Xiaomi Bebird Smart Ear Picker T5 Pink|0|Xiaomi|||1099.0|1299.0|Косметические приборы
Электрическая зубная щетка ORAL-B BRAUN Vitality 3D White/D100 Pink (4210201262169)|0|Oral-b Braun|||529.0|679.0|Зубные щетки и ирригаторы
Электрическая зубная щетка PHILIPS Sonicare ProtectiveClean 4500 HX6836/24|0|Philips|||2199.0|2699.0|Зубные щетки и ирригаторы
Аккумуляторный пылесос BOSCH BBS611LAG|0|Bosch|||6499.0|8799.0|Аккумуляторные пылесосы
Блендер TEFAL Easychef 3в1 HB453138|0|Tefal|||999.0|1499.0|Блендеры
Электрическая зубная щетка ORAL-B BRAUN Stage Power/D100 Cars (4210201244554)|0|Oral-b Braun|||529.0|679.0|Зубные щетки и ирригаторы
Мультиварка-скороварка MOULINEX Initial Pressure CE620D34|0|Moulinex|||3299.0|3999.0|Мультиварки
Кофемашина SAECO Lirika One Touch Cappuccino 10004768|0|Saeco|||11225.0|13475.0|Кофеварки
Миксер BOSCH MFQ2600W|0|Bosch|||1699.0|1829.0|Миксеры
Кофемашина DELONGHI ECAM 22.110 B|0|Delonghi|||10999.0|11999.0|Кофеварки
Электрическая зубная щетка PHILIPS Sonicare DiamondClean Smart HX9954/57|0|Philips|||9499.0|0.0|Зубные щетки и ирригаторы
Мясорубка BOSCH MFW3X15W|0|Bosch|||3939.0|4199.0|Мясорубки
Кухонная машина POLARIS PKM 1101|0|Polaris|||4048.0|5499.0|Кухонные комбайны
Машинка для стрижки волос Vitek VT-2511 BK|0|Vitek|||399.0|549.0|Машинки для стрижки
Электрическая зубная щетка ORAL-B BRAUN Stage Power/D100 Pixar Gift Limited Edition (4210201314639)|0|Oral-b Braun|||529.0|679.0|Зубные щетки и ирригаторы
Электробритва Philips Shaver series 7000 S7786/55|0|Philips|||5499.0|5499.0|Электробритвы
Электрическая зубная щетка ORAL-B BRAUN Junior (4210201202370)|0|Oral-b Braun|||999.0|1349.0|Зубные щетки и ирригаторы
Выпрямитель волос Dyson Corrale HS03 с набором расчесок|0|Dyson|||15990.0|0.0|Приборы для укладки волос
Фотоэпилятор BRAUN Silk-expert Pro 5 PL 5014|0|Braun|||10999.0|13799.0|Фотоэпиляторы
Бесконтактный инфракрасный термометр ProMedica IRT|0|ProMedica|||1047.0|0.0|Термометры для тела
Плойка RZTK CI 5023|0|RZTK|||299.0|495.0|Приборы для укладки волос
Электрическая зубная щетка ORAL-B BRAUN Special Edition Genius X 20000N Rose Gold (4210201295594)|0|Oral-b Braun|||6799.0|0.0|Зубные щетки и ирригаторы
Скрабер ультразвуковой Ultrasonic PL-C01 green|0|Ultrasonic|||1199.0|0.0|Косметические приборы
Утюг Tefal Access Easy FV1543|0|Tefal|||899.0|1199.0|Утюги и гладильные системы
Набор по уходу за полостью рта Philips AirFloss Pro/Ultra HX8494/01|0|Philips|||8399.0|9499.0|Зубные щетки и ирригаторы
Фен Philips с технологией SenseIQ BHD827/00|0|Philips|||8999.0|8999.0|Фены
Гриль DELONGHI MultiGrill CGH1012D|0|Delonghi|||6299.0|7999.0|Грили и электрошашлычницы
Тонометр MICROLIFE BP A2 Classic|0|Microlife|||1191.0|0.0|Тонометры
Нож сменный + сеточка для бритв BRAUN Series 3 21B|0|Braun|||899.0|899.0|Аксессуары к товарам по уходу за телом
Электрическая зубная щетка ORAL-B BRAUN Expert/DB4 (4210201822448)|0|Oral-b Braun|||499.0|0.0|Зубные щетки и ирригаторы
Массажный пояс BEURER MG 151|0|Beurer|||3939.0|0.0|Массажеры
Соковыжималка центробежная MAGIO MG-192|0|Magio|||969.0|999.0|Соковыжималки
Дыхательный тренажер Фролова Динамика|0|Динамика|||374.0|420.0|Аппараты для дыхания и кислородной терапии
Весы кухонные BEURER KS KS 19 Sequence|0|Beurer|||629.0|789.0|Весы кухонные
Весы диагностические Tefal Bodysignal BM7100|0|Tefal|||1199.0|1449.0|Весы напольные
Электрочайник Tefal SAFE TO TOUCH 1.7L KO260130 White|0|Tefal|||1199.0|1599.0|Электрочайники
Сменная панель DELONGHI DLSK150|0|Delonghi|||1999.0|1999.0|Аксессуары для электрогрилей
Блок+сетка BRAUN series 3 30B|0|Braun|||999.0|0.0|Аксессуары к товарам по уходу за телом
Робот-пылесос iRobot Roomba S9|0|iRobot|||26999.0|32999.0|Роботы-пылесосы
Дыхательный тренажер САМОЗДРАВ Комфорт|0|Самоздрав|||1020.0|0.0|Аппараты для дыхания и кислородной терапии
Эпилятор Rowenta EP1110 Easy Touch|0|Rowenta|||749.0|0.0|Эпиляторы
Блок и сетка для электробритв BRAUN 10В (series 1)|0|Braun|||899.0|899.0|Аксессуары к товарам по уходу за телом
Термометр VEGA МТ 418|0|VEGA|||116.0|0.0|Термометры для тела
Бритвенная головка PHILIPS Shaver S9000 Prestige SH98/70|0|Philips|||1999.0|1999.0|Аксессуары к товарам по уходу за телом
Блок+сетка BRAUN 11В (series 1)|0|Braun|||899.0|899.0|Аксессуары к товарам по уходу за телом
Соковыжималка центробежная GRUNHELM GJR610|0|Grunhelm|||829.0|1011.0|Соковыжималки
Кулер для воды HOTFROST V1133CE|0|HotFrost|||3220.0|3420.0|Кулеры для воды
Кулер для воды COOPER&HUNTER CH-D120E|0|Cooper&Hunter|||1668.0|1674.0|Кулеры для воды
Микроволновая печь WHIRLPOOL MWP 251 SB|0|Whirlpool|||3999.0|3999.0|Микроволновые печи
Швейная машина JANOME Sew Dream 510|0|Janome|||4599.0|0.0|Швейные машинки
Соковыжималка шнековая STEBA E 400|0|Steba|||6755.0|6022.0|Соковыжималки
Массажер BEURER MG 155|0|Beurer|||2499.0|0.0|Массажеры
Электропростынь BEURER UB 86|0|Beurer|||5339.0|0.0|Электропростыни
Яйцеварка SEVERIN EK 3156|0|Severin|||975.0|869.0|Яйцеварки
Робот-пылесос Xiaomi Mi Robot Vacuum-Mop 1С STYTJ01ZHM (Международная версия)|0|Xiaomi|||6499.0|7499.0|Роботы-пылесосы
Пылесос без мешка Philips 3000 series FC9334/09|0|Philips|||3399.0|4399.0|Пылесосы для сухой уборки
Планетарный миксер FIRST FA-5259-4|0|First|||3679.0|3679.0|Кухонные комбайны
Кофемашина SIEMENS TE653M11RW|0|Siemens|||19999.0|27999.0|Кофеварки
Мясорубка BOSCH MFW3X18W|0|Bosch|||5899.0|5599.0|Мясорубки
Кофемашина KRUPS Arabica Latte EA819N10|0|Krups|||14999.0|21999.0|Кофеварки
Фен ROWENTA CV8722 Infini Pro elite|0|Rowenta|||899.0|1099.0|Фены
Весы напольные MAGIO MG-300 NEW|0|Magio|||299.0|389.0|Весы напольные
Электрочайник BOSCH TWK 7203|0|Bosch|||4799.0|4299.0|Электрочайники
Миксер BOSCH MFQ36490|0|Bosch|||2799.0|0.0|Миксеры
Утюг PHILIPS Azur GC4556/20|0|Philips|||2199.0|2499.0|Утюги и гладильные системы
Гриль TEFAL Grill Inicio GC242832|0|Tefal|||2499.0|2699.0|Грили и электрошашлычницы
Набор для стрижки PANASONIC ER-GY10CM520|0|Panasonic|||1099.0|1299.0|Триммеры
Массажер BEURER CM 50|0|Beurer|||1919.0|2339.0|Массажеры
Тонометр VEGA VA-330|0|VEGA|||879.0|1031.0|Тонометры
Машинка для стрижки волос PHILIPS HC3520/15|0|Philips|||849.0|849.0|Машинки для стрижки
Набор для маникюра и педикюра BEURER MP 62|0|Beurer|||3099.0|3799.0|Фрезеры для маникюра и педикюра
Микроволновая печь Candy DIVO G20CG|0|Candy|||2599.0|0.0|Микроволновые печи
Эпилятор ROWENTA Aquasoft Wet&Dry EP4930|0|Rowenta|||1799.0|1999.0|Эпиляторы
Мороженица CUISINART ICE31GE|0|Cuisinart|||3899.0|0.0|Мороженицы
Тостер GORENJE T1000E|0|Gorenje|||1239.0|0.0|Тостеры
Яйцеварка CASO E9|0|Caso|||1545.0|0.0|Яйцеварки
Сменная панель DELONGHI DLSK155|0|Delonghi|||423.0|499.0|Аксессуары для бутербродниц и вафельниц
Лампа ESPERANZA UV LED Lamp EBN006 для полимеризации|0|Esperanza|||559.0|739.0|Лампы для маникюра
Щеточка для чистки лица Esperanza Face Cleaner EBM003T|0|Esperanza|||249.0|369.0|Косметические приборы
Весы кухонные ROTEX RSK21-P|0|Rotex|||419.0|0.0|Весы кухонные
Электробритва Xiaomi Enchen BlackStone 3D (6972417693011)|0|Xiaomi|||399.0|699.0|Электробритвы
Электробритва Philips Shaver series 5000 S5584/50|0|Philips|||4499.0|4499.0|Электробритвы
Фотоэпилятор BRAUN Silk-expert Pro 5 PL 5117|0|Braun|||12399.0|15499.0|Фотоэпиляторы
Бритвенная головка PHILIPS RQ32/20|0|Philips|||689.0|699.0|Аксессуары к товарам по уходу за телом
Кулер для воды HotFrost 350ANET Gold|0|HotFrost|||9800.0|9975.0|Кулеры для воды
Швейная машина SINGER TRADITION 2282|0|Singer|||5590.0|0.0|Швейные машинки
Шарф-грелка BEURER HK 37 To Go|0|Beurer|||2579.0|0.0|Электрогрелки
Аппарат для измельчения льда ARIETE sweet Granita 78|0|Ariete|||1129.0|0.0|Прочая мелкая техника
Электропростынь BEURER UB 83|0|Beurer|||3429.0|0.0|Электропростыни
Мясорубка MOULINEX ME307832|0|Moulinex|||2799.0|3699.0|Мясорубки
Миксер Bosch MFQ3650X|0|Bosch|||1699.0|0.0|Миксеры
Утюг RZTK V5 Pro|0|RZTK|||579.0|635.0|Утюги и гладильные системы
