Название|Остаток|Бренд|Описание|Артикул|Цена|Старая цена|Категория
Микроволновая печь SAMSUNG GE88SUB/BW|0|Samsung|||4399.0|4399.0|Микроволновые печи
Утюг PHILIPS EasySpeed GC1742/40|0|Philips|||777.0|0.0|Утюги и гладильные системы
Машинка для стрижки волос Xiaomi ENCHEN Boost White|0|Xiaomi|||549.0|699.0|Машинки для стрижки
Тонометр MICROLIFE BP AG 1-20|0|Microlife|||440.0|0.0|Тонометры
Пылесос без мешка SAMSUNG VC15K4176HG/UK|0|Samsung|||4699.0|5299.0|Пылесосы для сухой уборки
Миксер SCARLETT SC-HM40B01|0|Scarlett|||745.0|799.0|Миксеры
Насадка-мясорубка KENWOOD KAX950ME|0|Kenwood|||2589.0|3999.0|Аксессуары для кухонной техники
Весы напольные MAGIO MG-302 NEW|0|Magio|||259.0|319.0|Весы напольные
Плойка BABYLISS С338E|0|BaByliss|||699.0|899.0|Приборы для укладки волос
Кухонный комбайн PHILIPS Daily Collection HR7510/00|0|Philips|||3499.0|3499.0|Кухонные комбайны
Триммер BRAUN BT3221|0|Braun|||799.0|1149.0|Триммеры
Тостер DEX DT-212B|0|Dex|||550.0|609.0|Тостеры
Электрическая грелка Beurer HK 35 NEW|0|Beurer|||1569.0|0.0|Электрогрелки
Зеркало косметическое Axentia 282800|0|Axentia|||260.0|0.0|Зеркала косметические
Фотоэпилятор BABYLISS G960E|0|BaByliss|||4199.0|7999.0|Фотоэпиляторы
Гриль GEORGE FOREMAN 360 Grill 24640-56|0|George Foreman|||3999.0|4999.0|Грили и электрошашлычницы
Швейная машина MINERVA M320|0|Minerva|||4209.0|4399.0|Швейные машинки
Ирригатор PECHAM Professional (6902018567809)|0|Pecham|||1599.0|2599.0|Зубные щетки и ирригаторы
Набор электрических зубных щеток PECHAM Black and White Travel Set (0009119080224)|0|Pecham|||1199.0|1999.0|Зубные щетки и ирригаторы
Блендер BOSCH MSM14200|0|Bosch|||799.0|949.0|Блендеры
Кофемашина Saeco Royal One Touch Cappuccino|0|Saeco|||16999.0|18999.0|Кофеварки
Мультиварка RZTK МC 905H|0|RZTK|||999.0|1149.0|Мультиварки
Пылесос без мешка ROWENTA Silence Force Cyclonic 4A RO7690EA|0|Rowenta|||7999.0|9999.0|Пылесосы для сухой уборки
Электрическая зубная щетка ORAL-B BRAUN Pro2 2000 White (4210201272656)|0|Oral-b Braun|||1399.0|1999.0|Зубные щетки и ирригаторы
Пылесос для сухой уборки Electrolux EUSC64-EB|0|Electrolux|||3888.0|4999.0|Пылесосы для сухой уборки
Аккумуляторный пылесос Philips PowerPro Aqua Cordless FC6409/01|0|Philips|||9999.0|9999.0|Аккумуляторные пылесосы
Электрочайник BOSCH TWK8611P|0|Bosch|||4099.0|3649.0|Электрочайники
Блендер TEFAL BL438831|0|Tefal|||1999.0|2699.0|Блендеры
Электробритва Xiaomi PINJING (SO WHITE) 3D Smart Black ES3 (6970237662439)|0|Xiaomi|||699.0|899.0|Электробритвы
Фен ROWENTA CV9620 Ultimate Pro Digital|0|Rowenta|||2399.0|2849.0|Фены
Щипцы для волос PHILIPS Selfie Straightener HP8302/00|0|Philips|||549.0|549.0|Приборы для укладки волос
Щипцы для волос PHILIPS Pro HPS930/00|0|Philips|||2499.0|2499.0|Приборы для укладки волос
Тонометр OMRON M2 Basic (HEM-7121-RU)|0|Omron|||1396.0|0.0|Тонометры
Кофемашина DeLonghi ECAM 250.23 SB|0|Delonghi|||12499.0|0.0|Кофеварки
Гриль GEORGE FOREMAN Indoor Outdoor Grill 22460-56|0|George Foreman|||3999.0|5099.0|Грили и электрошашлычницы
Ингалятор B.Well PRO-110|0|B.Well|||744.0|949.0|Ингаляторы
Мясорубка MOULINEX ME442D|0|Moulinex|||2999.0|3099.0|Мясорубки
Весы напольные SCARLETT SC-BS33M042|0|Scarlett|||299.0|299.0|Весы напольные
Миксер SCARLETT SC-HM40S09|0|Scarlett|||375.0|0.0|Миксеры
Ирригатор Oral-B Aquacare Oxyjet (4210201233442)|0|Oral-b Braun|||2169.0|2699.0|Зубные щетки и ирригаторы
Кухонный комбайн PHILIPS Daily Collection HR7310/00|0|Philips|||2799.0|2799.0|Кухонные комбайны
Робот-пылесос iRobot Roomba S9+|0|iRobot|||37999.0|0.0|Роботы-пылесосы
Электрическая зубная щетка Playbrush Smart Sonic Blue (9010061000247)|0|Playbrush|||1299.0|1599.0|Зубные щетки и ирригаторы
Весы напольные ESPERANZA EBS002K|0|Esperanza|||299.0|349.0|Весы напольные
Щипцы для волос VITEK VT-8410 Crystal|0|Vitek|||449.0|659.0|Приборы для укладки волос
Набор для стрижки MIRTA SpeedPro6 HT-5206|0|Mirta|||249.0|299.0|Триммеры
Ванночка для ног BEURER FB 35|0|Beurer|||2999.0|0.0|Массажеры
Система для очистки бритвы BRAUN Clean&Charge 0-CC BLK|0|Braun|||1299.0|1299.0|Аксессуары к товарам по уходу за телом
Щетка для чистки лица SCARLETT SC-CA301F05|0|Scarlett|||229.0|0.0|Косметические приборы
Эпилятор BRAUN Silk epil 9 SES 9/980 SensoSmart|0|Braun|||5099.0|5999.0|Эпиляторы
Кофемашина SENCOR SES 9200CH|0|Sencor|||12199.0|16799.0|Кофеварки
Фотоэпилятор BEURER IPL Velvet Skin Pro|0|Beurer|||14999.0|18319.0|Фотоэпиляторы
Сеточка для бритв PANASONIC WES9089Y1361|0|Panasonic|||499.0|499.0|Аксессуары к товарам по уходу за телом
Йогуртница CLATRONIC JM 3344|0|Clatronic|||931.0|0.0|Йогуртницы
Кофемашина Liberty`s CLT-Q007|0|Liberty`s|||16331.0|18000.0|Кофеварки
Выпрямитель для волос Rowenta Elite Model Look SF4522|0|Rowenta|||999.0|1199.0|Приборы для укладки волос
Микроволновая печь SAMSUNG GE83KRS-2/BW|0|Samsung|||3099.0|3299.0|Микроволновые печи
Блендер BOSCH MSM66130|0|Bosch|||1199.0|1469.0|Блендеры
Фен ROWENTA Studio Glow CV5830|0|Rowenta|||699.0|0.0|Фены
Электробритва Xiaomi MSN M3 Electric Shaver|0|Xiaomi|||1299.0|1399.0|Электробритвы
Тонометр OMRON M3 expert (HEM-7132-ALRU)|0|Omron|||2482.0|0.0|Тонометры
Эпилятор BRAUN Silk epil 9 SES 9001 3D|0|Braun|||3999.0|5799.0|Эпиляторы
Миксер Scarlett SC-HM40S05|0|Scarlett|||289.0|349.0|Миксеры
Мультиварка TEFAL RK807D34|0|Tefal|||4399.0|4999.0|Мультиварки
Электрочайник PHILIPS HD9350/91|0|Philips|||999.0|1199.0|Электрочайники
Мясорубка ZELMER ZMM2851B|0|Zelmer|||1959.0|0.0|Мясорубки
Насадка для нарезки кубиками KENWOOD KAX400PL|0|Kenwood|||2589.0|3999.0|Аксессуары для кухонных комбайнов
Весы напольные ROTEX RSB05-P|0|Rotex|||269.0|0.0|Весы напольные
Капсульная кофеварка Dolce Aroma PINTA с системой Nespresso белый|0|Dolce Aroma|||3565.0|3565.0|Кофеварки
Триммер PHILIPS Beardtrimmer Series 7000 BT7520/15|0|Philips|||2899.0|2899.0|Триммеры
Швейная машина BROTHER ArtCity 250a|0|Brother|||5800.0|5800.0|Швейные машинки
Зеркало косметическое Spirella Akira черное (10.19847)|0|Spirella|||400.0|0.0|Зеркала косметические
Машинка для стрижки волос ROTEX RHC160-T|0|Rotex|||469.0|0.0|Машинки для стрижки
Фотоэпилятор REMINGTON IPL8500 I-LIGHT LUXE|0|Remington|||9999.0|15099.0|Фотоэпиляторы
Сушилка для овощей и фруктов ARDESTO FDB-5385|0|Ardesto|||1234.0|1299.0|Сушилки для овощей и фруктов
Утюг BOSCH TDA3024010|0|Bosch|||999.0|1449.0|Утюги и гладильные системы
Капельная кофеварка RZTK CM 1290K|0|RZTK|||569.0|675.0|Кофеварки
Триммер Philips series 3000 NT3650/16|0|Philips|||499.0|499.0|Триммеры
Электробритва Philips Shaver series 5000 S5587/10|0|Philips|||3199.0|3199.0|Электробритвы
Электрочайник BOSCH TWK3P424|0|Bosch|||1659.0|0.0|Электрочайники
Мультиварка-скороварка REDMOND RMC-P470|0|Redmond|||3350.0|5299.0|Мультиварки
Фен ROWENTA Studio Dry Blow CV5812|0|Rowenta|||599.0|649.0|Фены
Смарт-весы Xiaomi YUNMAI Mini Smart Scale Pink (M1501-PK)|0|Yunmai|||899.0|899.0|Весы напольные
Электрическая печь VINIS VO-4820B|0|Vinis|||2100.0|0.0|Электрические печи
Машинка для стрижки волос WAHL 300Series 09247-1316|0|Wahl|||1499.0|1499.0|Машинки для стрижки
Зеркало косметическое с подсветкой BEURER BS 69|0|Beurer|||2399.0|2999.0|Зеркала косметические
Весы кухонные BEURER KS 25|0|Beurer|||849.0|1119.0|Весы кухонные
Тостер TEFAL Express TT410D38|0|Tefal|||1299.0|0.0|Тостеры
Блендер TEFAL Turbomix HB121838|0|Tefal|||982.0|999.0|Блендеры
Ингалятор OMRON NE-C803 (NE-C803-E)|0|Omron|||1472.0|0.0|Ингаляторы
Насадка-спиралайзер KENWOOD KAX700PL|0|Kenwood|||2099.0|3999.0|Аксессуары для кухонных комбайнов
Зеркало косметическое Axentia 282802|0|Axentia|||450.0|0.0|Зеркала косметические
Тонометр B.Well wm-62s|0|B.Well|||489.0|0.0|Тонометры
Мясорубка KENWOOD MG 516|0|Kenwood|||6299.0|5999.0|Мясорубки
Ванночка для ног BEURER FB 12|0|Beurer|||1759.0|2629.0|Массажеры
Соковыжималка для цитрусовых PROFICOOK PC-ZP 1154|0|Profi Cook|||2399.0|2470.0|Соковыжималки
Эпилятор BRAUN Silk epil 9 SES 9020 3D|0|Braun|||5859.0|6899.0|Эпиляторы
Кофеварка Scishare Capsule Coffee Machine mini S1201|0|Scishare|||2499.0|2999.0|Кофеварки
Пылесос с аквафильтром THOMAS AQUA-BOX-COMPACT|0|Thomas|||6499.0|6499.0|Пылесосы для сухой уборки
Блендер TEFAL HB656838|0|Tefal|||1549.0|2299.0|Блендеры
Кофемашина KRUPS EA907D31 Barista|0|Krups|||39999.0|54999.0|Кофеварки
Мультиварка-скороварка NINJA OP500EU|0|Ninja|||10799.0|10799.0|Мультиварки
Микроволновая печь SAMSUNG ME83KRW-2/BW|0|Samsung|||2799.0|2999.0|Микроволновые печи
Фен BaByliss 6613DE PRO SILENCE VOLUME|0|BaByliss|||1349.0|1799.0|Фены
Утюг RZTK T Basik|0|RZTK|||199.0|265.0|Утюги и гладильные системы
Машинка для стрижки волос MIRTA HT-5218 TRUEMAN PRO hair clipper|0|Mirta|||899.0|1299.0|Машинки для стрижки
Электробритва BRAUN Series 3 300BT black/green|0|Braun|||1499.0|2099.0|Электробритвы
Набор по уходу за лицом BRAUN FaceSpa Pro 912|0|Braun|||3199.0|3989.0|Косметические приборы
Весы кухонные BEURER KS 34 stainless steel|0|Beurer|||999.0|1249.0|Весы кухонные
Электрическая печь MIRTA MO-0036 B|0|Mirta|||1329.0|1425.0|Электрические печи
Смарт-весы Xiaomi YUNMAI X Smart Scale White (M1825CH-WH)|0|Yunmai|||949.0|0.0|Весы напольные
Насадка терка-ломтерезка KENWOOD KAX643ME|0|Kenwood|||2589.0|3999.0|Аксессуары для кухонных комбайнов
Электрочайник GORENJE K17WII|0|Gorenje|||649.0|779.0|Электрочайники
Триммер универсальный PANASONIC ER-GB60-K520|0|Panasonic|||1499.0|1899.0|Триммеры
Массажер BEURER MG 17|0|Beurer|||780.0|0.0|Массажеры
Швейная машина MINERVA M823B|0|Minerva|||3799.0|0.0|Швейные машинки
Миксер POLARIS PHM 7016|0|Polaris|||649.0|749.0|Миксеры
Груммер BRAUN FG 1100 Pink|0|Braun|||679.0|799.0|Триммеры
Электрочайник Bosch TWK3P421|0|Bosch|||1659.0|0.0|Электрочайники
Машинка для стрижки волос Vitek VT-2569|0|Vitek|||399.0|459.0|Машинки для стрижки
Фен Jimmy F6 фиолетовый|0|Jimmy|||4999.0|4999.0|Фены
Эпилятор PHILIPS Satinelle Essential BRE245/00|0|Philips|||949.0|1149.0|Эпиляторы
Утюг BRAUN SI7065BL|0|Braun|||1999.0|2399.0|Утюги и гладильные системы
Тостер TEFAL Equinox TT420D|0|Tefal|||1349.0|0.0|Тостеры
Весы кухонные BEURER KS 19 Black|0|Beurer|||629.0|789.0|Весы кухонные
Швейная машина JANOME 1820s|0|Janome|||5599.0|0.0|Швейные машинки
Соковыжималка центробежная SCARLETT SC-JE50S42|0|Scarlett|||1599.0|1789.0|Соковыжималки
Ингалятор LONGEVITA CNB69008|0|Longevita|||699.0|0.0|Ингаляторы
Насадка-мясорубка BOSCH MUZ5FW1|0|Bosch|||2699.0|2699.0|Аксессуары для кухонной техники
Смарт-весы Xiaomi YUNMAI Balance Smart Scale Black (M1690-BK)|0|Yunmai|||949.0|0.0|Весы напольные
Щетка для чистки лица BEURER FC 49|0|Beurer|||1179.0|1179.0|Косметические приборы
Весы кухонные Esperanza EKS005|0|Esperanza|||379.0|399.0|Весы кухонные
Миксер VITEK VT-1426|0|Vitek|||579.0|0.0|Миксеры
Мультиварка-скороварка NINJA OP300EU|0|Ninja|||8999.0|9999.0|Мультиварки
Сушилка для овощей и фруктов ROTEX RD310-W|0|Rotex|||1016.0|1069.0|Сушилки для овощей и фруктов
Электрическая грелка BEURER HK 54 Cosy|0|Beurer|||2249.0|0.0|Электрогрелки
Аккумуляторный пылесос ROWENTA Air Force Flex Aqua 560 RH9490WO|0|Rowenta|||11999.0|14999.0|Аккумуляторные пылесосы
Моющий пылесос с аквафильтром THOMAS DRYBOX AMFIBIA PET|0|Thomas|||12999.0|12299.0|Моющие пылесосы
Фен-щетка ROWENTA Brush Activ Premium Care CF9540|0|Rowenta|||2049.0|0.0|Приборы для укладки волос
Фен ROWENTA Motion dry CV5712F0|0|Rowenta|||599.0|749.0|Фены
Фен-щетка ROWENTA Ultimate Experience CF9620|0|Rowenta|||3299.0|0.0|Приборы для укладки волос
Робот-пылесос XIAOMI RoboRock E4 Black (E452-02)|0|Xiaomi|||5999.0|7999.0|Роботы-пылесосы
Микроволновая печь BOSCH HMT72M420|0|Bosch|||2299.0|3099.0|Микроволновые печи
Пылесос без мешка ROWENTA Silence Force Cyclonic RO7260ЕА|0|Rowenta|||5599.0|6999.0|Пылесосы для сухой уборки
Машинка для завивки волос PHILIPS StyleCare Prestige BHB876/00|0|Philips|||3999.0|3999.0|Приборы для укладки волос
Кофемашина Saeco Royal Black|0|Saeco|||13999.0|16999.0|Кофеварки
Набор электрических зубных щеток PHILIPS ProtectiveClean 4500 HX6830/35|0|Philips|||4199.0|5999.0|Зубные щетки и ирригаторы
Щипцы для волос ROWENTA for Elite OPTILISS IONIC SF3232|0|Rowenta|||899.0|0.0|Приборы для укладки волос
Триммер PHILIPS Series 1000 MG1100/16|0|Philips|||699.0|699.0|Триммеры
Ирригатор PANASONIC EW-DJ10-A520|0|Panasonic|||1099.0|0.0|Зубные щетки и ирригаторы
Электрическая зубная щетка PHILIPS DiamondClean Smart HX9903/03|0|Philips|||6319.0|7899.0|Зубные щетки и ирригаторы
Электробритва Philips Shaver series 5000 S5583/38|0|Philips|||4499.0|4499.0|Электробритвы
Зеркало косметическое с подсветкой BEURER BS 55|0|Beurer|||1749.0|2129.0|Зеркала косметические
Mассажная подушка BEURER MG 135 Shiatsu|0|Beurer|||2819.0|0.0|Массажеры
Блендер Philips Avance Collection HR3756/00|0|Philips|||8499.0|8499.0|Блендеры
Мясорубка BOSCH MFW67440|0|Bosch|||5899.0|0.0|Мясорубки
Двойное зеркало для макияжа Mindo с LED подсветкой 5X (D710T) (2500000009112)|0|Mindo|||559.0|1080.0|Зеркала косметические
Машинка для стрижки волос ROWENTA TN5221F4|0|Rowenta|||1299.0|1449.0|Машинки для стрижки
Фен-щетка Esperanza Hair Curler EBL008|0|Esperanza|||399.0|699.0|Приборы для укладки волос
Плойка PHILIPS StyleCare BHB871/00|0|Philips|||1249.0|1249.0|Приборы для укладки волос
Эпилятор ROWENTA Aquasoft Wet&Dry EP4920|0|Rowenta|||1559.0|1749.0|Эпиляторы
Электрическая печь Esperanza EKO004|0|Esperanza|||769.0|899.0|Электрические печи
Бритвенные головки Philips Shaver series 7000, 5000 SH71/50|0|Philips|||1199.0|1199.0|Аксессуары к товарам по уходу за телом
Кофемолка DELONGHI KG200|0|Delonghi|||1099.0|1899.0|Кофемолки
Швейная машина MINERVA M190|0|Minerva|||3479.0|0.0|Швейные машинки
Набор по уходу за лицом BRAUN FaceSpa Pro 911|0|Braun|||3199.0|3799.0|Косметические приборы
Ингалятор B.Well PRO-115|0|B.Well|||1299.0|0.0|Ингаляторы
Электрочайник BRAUN WK500 BK|0|Braun|||849.0|1599.0|Электрочайники
Пилка электрическая для педикюра CECOTEC SkinCare Silky (CCTC-04222)|0|Cecotec|||699.0|799.0|Пилки электрические
Прибор для ухода за кожей лица BEURER FC 90|0|Beurer|||4989.0|7849.0|Косметические приборы
Вытяжка для маникюра SIMEI 858-8 на 80W|0|Simei|||749.0|849.0|Вытяжки для маникюра
Щипцы для волос беспроводные RZTK HS 2018|0|RZTK|||399.0|595.0|Приборы для укладки волос
Зеркало косметическое съемное с подсветкой BEURER BS 59|0|Beurer|||1849.0|1849.0|Зеркала косметические
Машинка для стрижки волос Babyliss E973E|0|BaByliss|||1099.0|1299.0|Машинки для стрижки
Щетка для чистки лица BEURER FC 65|0|Beurer|||1699.0|2129.0|Косметические приборы
Массажер BEURER MG 16|0|Beurer|||729.0|0.0|Массажеры
Эпилятор PANASONIC ES-EL2A-A520|0|Panasonic|||1899.0|2299.0|Эпиляторы
Массажная накидка BEURER MG 320|0|Beurer|||9139.0|11139.0|Массажеры
Щеточка косметическая REMINGTON Reveal FC1000 по уходу за лицом женская|0|Remington|||3199.0|3199.0|Косметические приборы
Зеркало косметическое Spirella Akira белое (10.19848)|0|Spirella|||400.0|0.0|Зеркала косметические
Зеркало косметическое Xiaomi Jordan Judy Handheld Light Mirror Black|0|Xiaomi|||399.0|599.0|Зеркала косметические
Набор для маникюра и педикюра Sanitas SMA 36|0|SANITAS|||1699.0|2179.0|Фрезеры для маникюра и педикюра
Массажная накидка BEURER MG 254|0|Beurer|||8689.0|0.0|Массажеры
Инфракрасная лампа MOMERT 3001 (5997307530017)|0|Momert|||1150.0|1474.0|Косметические приборы
Зеркало косметическое карманное Titania 1545 L Оранжевое (1545 L_orange)|0|Titania|||89.0|119.0|Зеркала косметические
Маникюрный набор SCARLETT SC-MS95007 Blue|0|Scarlett|||199.0|259.0|Фрезеры для маникюра и педикюра
Массажный пояс BEURER MG 153 4D|0|Beurer|||3719.0|0.0|Массажеры
Зеркало косметическое Qtap Liberty BLM 1147|0|Qtap|||622.0|0.0|Зеркала косметические
Зеркало косметическое Axentia 126807|0|Axentia|||419.0|419.0|Зеркала косметические
Зеркало косметическое Spirella Akira серо-голубое (10.19850)|0|Spirella|||400.0|400.0|Зеркала косметические
Зеркало в раме Titania косметическое 14.5 х 19.5 см (4008576391771)|0|Titania|||339.0|458.0|Зеркала косметические
Зеркало косметическое BEURER BS 99|0|Beurer|||3599.0|3599.0|Зеркала косметические
Утюг с парогенератором Braun IS 5145 WH|0|Braun|||4799.0|7499.0|Утюги и гладильные системы
Кисточка для завивки ресниц Xiaomi inFace ZH-02D Red|0|Xiaomi|||899.0|0.0|Косметические приборы
Зеркало косметическое QTAP Liberty ORO 1147|0|Qtap|||700.0|1007.0|Зеркала косметические
Щеточка для чистки лица BEURER FC 95|0|Beurer|||3289.0|3289.0|Косметические приборы
Инфракрасная лампа MOMERT 3000 (5997307530000)|0|Momert|||660.0|830.0|Косметические приборы
Тонометр LITTLE DOCTOR LD-3a|0|Little Doctor|||935.0|0.0|Тонометры
Прибор для чистки лица BEURER FC 40|0|Beurer|||859.0|1089.0|Косметические приборы
Сауна для лица BEURER FC 72|0|Beurer|||2859.0|3369.0|Косметические приборы
Щетка косметическая для тела BEURER FC 55|0|Beurer|||1999.0|2569.0|Косметические приборы
Зеркало косметическое ADLER AD 2168 LED|0|Adler|||479.0|539.0|Зеркала косметические
Насадка к щетке для чистки лица BEURER FC 48|0|Beurer|||339.0|0.0|Косметические приборы
Зеркало косметическое QTAP Liberty CRM 1147|0|Qtap|||584.0|745.0|Зеркала косметические
Зеркало косметическое BABYLISS 9450Е|0|BaByliss|||2999.0|3899.0|Зеркала косметические
Насадка-щеточка PHILIPS VisaPure SC5991/10|0|Philips|||315.0|315.0|Косметические приборы
Зеркало косметическое Spirella Akira зеленое (10.19849)|0|Spirella|||400.0|0.0|Зеркала косметические
Сменная лампа для фотоэпилятора REMINGTON SP-6000FQ|0|Remington|.||2999.0|3999.0|Фотоэпиляторы
Электрическая грелка BEURER HK 55 Easyfix|0|Beurer|||1969.0|0.0|Электрогрелки
Набор для пилинга лица BEURER FC 100|0|Beurer|||7389.0|7389.0|Косметические приборы
Массажер BEURER MG 16 red|0|Beurer|||729.0|0.0|Массажеры
Массажер BEURER MG 148|0|Beurer|||3499.0|0.0|Массажеры
Картридж для фотоэпилятора BEURER SalonPro System IPL 9000|0|Beurer|||6109.0|0.0|Фотоэпиляторы
Зеркало косметическое Axentia 282808|0|Axentia|||1677.0|1677.0|Зеркала косметические
Зеркало косметическое Axentia 126808|0|Axentia|||588.0|0.0|Зеркала косметические
Зеркало косметическое Simplehuman ST3036|0|Simplehuman|||4299.0|5130.0|Зеркала косметические
Набор для маникюра/педикюра BEURER MP 60 Present set (9 насадок)|0|Beurer|||3479.0|0.0|Фрезеры для маникюра и педикюра
Набор для маникюра и педикюра Sanitas SMA 35|0|SANITAS|||1959.0|0.0|Фрезеры для маникюра и педикюра
Зеркало косметическое QTAP Liberty ANT 1147|0|Qtap|||784.0|1007.0|Зеркала косметические
Зеркало косметическое Simplehuman ST3031|0|Simplehuman|||3600.0|0.0|Зеркала косметические
Лампа дневного света BEURER TL 90|0|Beurer|||6089.0|7119.0|Косметические приборы
Зеркало косметическое Kela Sade c подсветкой 20х20х38 см (20627)|0|Kela|||2864.0|0.0|Зеркала косметические
Зеркало косметическое Simplehuman ST3025|0|Simplehuman|||3600.0|0.0|Зеркала косметические
Зеркало косметическое GROHE Selection Cube 40808000|0|Grohe|||6099.0|0.0|Зеркала косметические
Лампа дневного света BEURER TL 70|0|Beurer|||4769.0|6229.0|Косметические приборы
Маникюрный набор SCARLETT SC-MS95006 Pink|0|Scarlett|||239.0|0.0|Фрезеры для маникюра и педикюра
