Название|Остаток|Бренд|Описание|Артикул|Цена|Старая цена|Категория
Швейная машина JANOME JUNO 523|0|Janome|||4399.0|4955.0|Швейные машинки
Эпилятор BRAUN Silk epil 9 SES 9/995 BS (81683682)|0|Braun|||5899.0|6899.0|Эпиляторы
Соковыжималка шнековая SMEG SJF01RDEU|0|Smeg|||21219.0|21219.0|Соковыжималки
Лампа дневного света BEURER TL 50|0|Beurer|||3449.0|4499.0|Косметические приборы
Отпариватель Tefal DT8150E0|0|Tefal|||1999.0|2299.0|Утюги и гладильные системы
Фен-щетка BaByliss AS136E|0|BaByliss|||2299.0|0.0|Приборы для укладки волос
Щипцы для волос ROWENTA EASYLISS SF1612|0|Rowenta|||449.0|599.0|Приборы для укладки волос
Щипцы для волос ROWENTA SF8210 Ultimate Experience|0|Rowenta|||4249.0|4499.0|Приборы для укладки волос
Машинка для стрижки волос ROWENTA TN5241F4|0|Rowenta|||1649.0|0.0|Машинки для стрижки
Щипцы для волос PHILIPS StraightCare Essential BHS377/00|0|Philips|||949.0|949.0|Приборы для укладки волос
Триммер Babyliss 7058PE|0|BaByliss|||599.0|749.0|Триммеры
Плойка SCARLETT SC-HS60593 Black|0|Scarlett|||249.0|0.0|Приборы для укладки волос
Кофеварка эспрессо VEGAS VCM-9070B|0|Vegas|||1599.0|1899.0|Кофеварки
Щипцы для волос VITEK VT-8408 гофре|0|Vitek|||369.0|399.0|Приборы для укладки волос
Щипцы для волос SCARLETT SC-HS60601 прикорневой объем|0|Scarlett|||269.0|0.0|Приборы для укладки волос
Сауна для лица BEURER FS 50|0|Beurer|||1399.0|1759.0|Косметические приборы
Щипцы для волос ROWENTA Pocket Power SF1120|0|Rowenta|||379.0|549.0|Приборы для укладки волос
Щипцы для волос Babyliss 2165CE (гофре)|0|BaByliss|||999.0|1299.0|Приборы для укладки волос
Фен Philips серии 3000 BHD341/10|0|Philips|||659.0|0.0|Фены
Плойка REMINGTON CI5319|0|Remington|||699.0|799.0|Приборы для укладки волос
Машинка для стрижки волос CECOTEC PrecisionCare ProClipper Titanium CCTC-04217|0|Cecotec|||699.0|1199.0|Машинки для стрижки
Кофемашина MIELE CM 5510 розовое золото|0|Miele|||33999.0|35990.0|Кофеварки
Щипцы для волос MIRTA SENSITIVE SHINE HS-5127|0|Mirta|||185.0|209.0|Приборы для укладки волос
Щипцы для волос Rowenta Premium Care Liss&Curl SF7660|0|Rowenta|||1699.0|1999.0|Приборы для укладки волос
Щипцы для волос Polaris PHS 5095TAi wave Argan Therapy PRO|0|Polaris|||1299.0|1799.0|Приборы для укладки волос
Эпилятор BRAUN SE 5511|0|Braun|||1799.0|1999.0|Эпиляторы
Фен-щетка Babyliss 2656E|0|BaByliss|||599.0|0.0|Приборы для укладки волос
Электробритва BRAUN Series 5 50-R1200s BLACK/RED|0|Braun|||3499.0|3499.0|Электробритвы
Картридж PANASONIC WES035K503|0|Panasonic|||299.0|599.0|Аксессуары к товарам по уходу за телом
Тостер SMEG TSF01PBEU|0|Smeg|||5555.0|0.0|Тостеры
Плойка Babyliss 271CE|0|BaByliss|||439.0|439.0|Приборы для укладки волос
Ингалятор BEURER IH 40|0|Beurer|||2599.0|0.0|Ингаляторы
Утюг Philips 6000 series DST6008/20|0|Philips|||1999.0|2299.0|Утюги и гладильные системы
Фен ROWENTA Signature Pro CV7812|0|Rowenta|||849.0|999.0|Фены
Эпилятор BRAUN Silk epil 5 SES 5/610 SensoSmart|0|Braun|||2399.0|2799.0|Эпиляторы
Триммер универсальный Babyliss BG120E|0|BaByliss|||999.0|1299.0|Триммеры
Электробритва PANASONIC ES-RF31-S520|0|Panasonic|||3299.0|0.0|Электробритвы
Ирригатор AQUAJET LD-A8 yellow|0|Aquajet|||1970.0|0.0|Зубные щетки и ирригаторы
Сушилка для овощей и фруктов CLATRONIC DR2751|0|Clatronic|||1359.0|0.0|Сушилки для овощей и фруктов
Весы диагностические BEURER BF 220|0|Beurer|||1099.0|1379.0|Весы напольные
Йогуртница SEVERIN JG 3519|0|Severin|||1499.0|0.0|Йогуртницы
Отпариватель PHILIPS EasyTouch Plus GC527/20|0|Philips|||2899.0|3099.0|Утюги и гладильные системы
Аккумуляторный пылесос SAMSUNG Jet 75 VS20T7536T5/EV|0|Samsung|||14999.0|17499.0|Аккумуляторные пылесосы
Эпилятор BRAUN Silk epil 5 SES 5/820 + Груммер BRAUN FG 1100|0|Braun|||2999.0|3499.0|Эпиляторы
Электрическая печь SATURN ST-EC3802 Black|0|Saturn|||1699.0|0.0|Электрические печи
Весы напольные SCARLETT SC-BS33E067|0|Scarlett|||359.0|0.0|Весы напольные
Триммер универсальный PANASONIC ER-GB70-S520|0|Panasonic|||1999.0|1999.0|Триммеры
Машинка для стрижки волос Babyliss E974E|0|BaByliss|||1099.0|1299.0|Машинки для стрижки
Электробритва НОВЫЙ ХАРЬКОВ НХ-9512 Старт|0|Новый Харьков|||379.0|550.0|Электробритвы
Фен CECOTEC Bamba IoniCare 5200 Aura CCTC-04200|0|Cecotec|||649.0|799.0|Фены
Тостер CASO Novea T2|0|Caso|||4398.0|4398.0|Тостеры
Аккумуляторный пылесос ROWENTA Air Force Light RH6545WH|0|Rowenta|Тип пылесоса: аккумуляторный пылесос. Тип уборки: сухая. Насадки: Power Light. Регулировка мощности: на ручке. Объем пылесборника: 0.65 л. Цвет: Черный.||2499.0|3999.0|Аккумуляторные пылесосы
Набор для стрижки BRAUN MGK7221 + бритва Gillette|0|Braun|||1999.0|2599.0|Триммеры
Стайлер Remington AS8606 Curl & Straight Confidence|0|Remington|||1599.0|2699.0|Приборы для укладки волос
Ирригатор PANASONIC EW1511|0|Panasonic|||2899.0|0.0|Зубные щетки и ирригаторы
Ирригатор PANASONIC EW-DJ40-W520|0|Panasonic|||1599.0|0.0|Зубные щетки и ирригаторы
Электробритва женская BRAUN FS1000|0|Braun|||849.0|999.0|Электробритвы
Эпилятор BRAUN Silk epil 9 MBSES9F MaxBraun (TYPE 5380 100лет)|0|Braun|||5499.0|6499.0|Эпиляторы
Ингалятор OMRON Nami Cat (NE-C303К-KDE)|0|Omron|||1820.0|0.0|Ингаляторы
Фен REMINGTON AC 5999|0|Remington|||1349.0|1799.0|Фены
Электрическая печь VENTOLUX DIANA|0|Ventolux|||2549.0|0.0|Электрические печи
Триммер (набор для стрижки) BRAUN MBMGK5 MaxBraun (TYPE 5541 100лет)|0|Braun|||1499.0|2199.0|Триммеры
Весы напольные SCARLETT SC-BS33M043|0|Scarlett|||299.0|299.0|Весы напольные
Чаша для мультиварок-скороварок ROTEX RIP5053-A|0|Rotex|||329.0|309.0|Аксессуары для мультиварок и пароварок
Фен REMINGTON AC9007 Salon Collection|0|Remington|||1999.0|0.0|Фены
Машинка для стрижки волос Babyliss E986E|0|BaByliss|||2099.0|2599.0|Машинки для стрижки
Утюг с парогенератором Braun CareStyle7 IS 7044|0|Braun|||4999.0|8999.0|Утюги и гладильные системы
Весы кухонные электронные Rotex RSK14-P Grape|0|Rotex|||249.0|319.0|Весы кухонные
Электробритва ХАРЬКОВ 7500|0|Харьков|||515.0|645.0|Электробритвы
Эпилятор BRAUN Silk epil 9 SES 9/975 BS (81683684)|0|Braun|||5799.0|6799.0|Эпиляторы
Ингалятор OMRON NE-U780 (NЕ-U780-Е)|0|Omron|||90824.0|0.0|Ингаляторы
Сушилка для овощей и фруктов STEBA ED 5|0|Steba|||2799.0|2925.0|Сушилки для овощей и фруктов
Моющий пылесос с аквафильтром BOSCH BWD41740|0|Bosch|||5699.0|6999.0|Моющие пылесосы
Пылесос без мешка SAMSUNG VC05K71G0HC/UK|0|Samsung|||6199.0|7499.0|Пылесосы для сухой уборки
Ирригатор Philips AirFloss Ultra HX8438/03|0|Philips|||3199.0|0.0|Зубные щетки и ирригаторы
Насадки к электрической зубной щетке Pecham black Travel (0290119080301)|0|Pecham|||188.0|210.0|Зубные щетки и ирригаторы
Аккумуляторный пылесос PHILIPS SpeedPro Aqua FC6729/01|0|Philips|||9799.0|13999.0|Аккумуляторные пылесосы
Плойка тройная ROWENTA CF4710F0|0|Rowenta|||1499.0|1849.0|Приборы для укладки волос
Фильтры для кофеварок MENALUX CFP4|0|Menalux|||99.0|99.0|Аксессуары для кофеварок и кофемашин
Электрическая зубная щетка Xiaomi Oclean X White|0|Xiaomi|||1499.0|1699.0|Зубные щетки и ирригаторы
Пылесос без мешка SAMSUNG VC05K41H0HG/UK|0|Samsung|||4299.0|5299.0|Пылесосы для сухой уборки
Фильтр для кофе FINUM №2|0|Finum|||75.0|99.0|Аксессуары для кофеварок и кофемашин
Аккумуляторный пылесос PHILIPS SpeedPro Aqua FC6728/01|0|Philips|||8799.0|12999.0|Аккумуляторные пылесосы
Фен-щетка BRAUN AS 530 Black|0|Braun|||1649.0|1649.0|Приборы для укладки волос
Тонометр OMRON EVOLV (НЕМ-7600T-E)|0|Omron|||5929.0|0.0|Тонометры
Фен-щетка ROWENTA CF 7812|0|Rowenta|||999.0|999.0|Приборы для укладки волос
Помпа механическая HotFrost A30 (с краником, пакет с европодвесом)|0|HotFrost|Тип: помпа для воды. Объём: 18,9 л. Материал: пластик. Габариты (ВхШхГ): 22х10,8х10,8 см.||135.0|0.0|Аксессуары к кулерам для воды
Электробритва BRAUN Series 9 9390 CC|0|Braun|||12999.0|12999.0|Электробритвы
Щипцы-плойка ROWENTA SF 6220|0|Rowenta|||1549.0|1549.0|Приборы для укладки волос
Утюг с парогенератором Tefal Pro Express Ultimate GV9581|0|Tefal|||9799.0|10999.0|Утюги и гладильные системы
Тонометр NISSEI WS-1000|0|Nissei|||1145.0|0.0|Тонометры
Фен-щетка BaByliss AS952E|0|BaByliss|||1999.0|1999.0|Приборы для укладки волос
Щипцы для волос ROWENTA LISS&CURL SF4412|0|Rowenta|||949.0|1099.0|Приборы для укладки волос
Фен ROWENTA CV1612 Handy Dry|0|Rowenta|||449.0|0.0|Фены
Щипцы для волос BaByliss ST393E|0|BaByliss|||1799.0|1949.0|Приборы для укладки волос
Груммер BRAUN FG 1100|0|Braun|||679.0|799.0|Триммеры
Плойка REMINGTON CI8605 Advanced Colour Protect|0|Remington|||1499.0|1899.0|Приборы для укладки волос
Плойка тройная BABYLISS С260E|0|BaByliss|||1299.0|1499.0|Приборы для укладки волос
Фильтр для кофе многоразовый Finum Coffee Star №4|0|Finum|||199.0|229.0|Аксессуары для кофеварок и кофемашин
Машинка для стрижки волос MAGIO MG-182 N|0|Magio|||239.0|0.0|Машинки для стрижки
Бесконтактный инфракрасный термометр PowerPlant (FT-100B)|0|PowerPlant|||2569.0|0.0|Термометры для тела
Плойка MAGIO MG-705|0|Magio|||299.0|0.0|Приборы для укладки волос
Плойка тройная BABYLISS W2447E|0|BaByliss|||1899.0|1899.0|Приборы для укладки волос
Тонометр OMRON RS1 (НЕМ-6160-E)|0|Omron|||1217.0|0.0|Тонометры
Щетка-выпрямитель ROWENTA CF5820F0|0|Rowenta|||1199.0|1399.0|Приборы для укладки волос
Плойка Babyliss С454E|0|BaByliss|||1299.0|1299.0|Приборы для укладки волос
Сменная пленка к вакуумному упаковщику TINTON LIFE 28x500 см|0|Tinton Life|||126.0|0.0|Аксессуары для вакуумных упаковщиков
Помпа для воды KASMET Pump Dispenser Black (UFTPDBlack)|0|Kasmet|||339.0|299.0|Аксессуары к кулерам для воды
Фильтр для кофеварок Menalux FP01|0|Menalux|||249.0|249.0|Аксессуары для кофеварок и кофемашин
Щипцы для волос POLARIS PHS 2011KZ Black гофре|0|Polaris|||549.0|749.0|Приборы для укладки волос
Тонометр BOKANG ВК 6002 (6931038660024)|0|Bokang|||460.0|0.0|Тонометры
Щипцы для волос BaByliss ST250E|0|BaByliss|||999.0|1299.0|Приборы для укладки волос
Бигуди BaByliss RS035E|0|BaByliss|||1599.0|1999.0|Приборы для укладки волос
Тонометр OMRON RS7 Intelli IT (НЕМ-6232Т-E)|0|Omron|||4187.0|0.0|Тонометры
Плойка Polaris PHS 1570K|0|Polaris|||599.0|799.0|Приборы для укладки волос
Тонометр NISSEI DS-500|0|Nissei|||1163.0|0.0|Тонометры
Уплотнительное кольцо для крышки скороварки ROTEX|0|Rotex|||99.0|99.0|Аксессуары для кухонной техники
Сменная пленка к вакуумному упаковщику ELECTROLUX EVSR1|0|Electrolux|||469.0|549.0|Аксессуары для вакуумных упаковщиков
Плойка ROWENTA Curls Forever CF3112|0|Rowenta|||749.0|899.0|Приборы для укладки волос
Фен-щетка Esperanza Hair Curler EBL001K|0|Esperanza|||199.0|299.0|Приборы для укладки волос
Плойка Remington CI5408 Mineral Glow|0|Remington|||738.0|949.0|Приборы для укладки волос
Плойка Polaris PHS 1509TAi stick Argan Therapy PRO|0|Polaris|||999.0|1499.0|Приборы для укладки волос
Тонометр LITTLE DOCTOR LD-71|0|Little Doctor|||375.0|0.0|Тонометры
Помпа для воды HOTFROST В1|0|HotFrost|||89.0|0.0|Аксессуары к кулерам для воды
Фильтры для кофе Paclan №4 80 шт (5900942150052)|0|Paclan|||108.0|96.0|Аксессуары для кофеварок и кофемашин
Термобигуди REMINGTON H9100 ProLuxe|0|Remington|||1999.0|2299.0|Приборы для укладки волос
Плойка Polaris PHS 2285K|0|Polaris|||649.0|829.0|Приборы для укладки волос
Помпа для воды HOTFROST А6|0|HotFrost|||99.0|0.0|Аксессуары к кулерам для воды
Плойка Polaris PHS 3410TAi Argan Therapy PRO|0|Polaris|||999.0|1499.0|Приборы для укладки волос
Плойка MIRTA BLACK DIAMOND HS-5112|0|Mirta|||289.0|289.0|Приборы для укладки волос
Плойка BABYLISS C325E|0|BaByliss|||649.0|849.0|Приборы для укладки волос
Пакеты для вакуумирования GORENJE VB12/55|0|Gorenje|||259.0|279.0|Аксессуары для вакуумных упаковщиков
Плойка REMINGTON CI9132 ProLuxe|0|Remington|||1499.0|1799.0|Приборы для укладки волос
Плойка-выпрямитель MAGIO MG-677|0|Magio|||289.0|0.0|Приборы для укладки волос
Электрическая зубная щетка Colgate Proclinical 150|0|Colgate|||499.0|527.0|Зубные щетки и ирригаторы
Пакеты для вакуумирования ELECTROLUX EVSB1|0|Electrolux|||489.0|549.0|Аксессуары для вакуумных упаковщиков
Щипцы для волос MAGIO MG-577|0|Magio|||379.0|0.0|Приборы для укладки волос
Тонометр NISSEI DS-10|0|Nissei|||920.0|996.0|Тонометры
Картридж фильтра для воды Philips CA6702/10|0|Philips|||417.0|419.0|Аксессуары для кофеварок и кофемашин
Помпа для воды HOTFROST A10|0|HotFrost|||225.0|255.0|Аксессуары к кулерам для воды
Тонометр VEGA VМ-200|0|VEGA|||369.0|0.0|Тонометры
Ирригатор Oclean W1 White|0|Oclean|||1799.0|0.0|Зубные щетки и ирригаторы
Ролики сменные для пилки ROTEX RHC520-P (2910637623009)|0|Rotex|||99.0|139.0|Пилки электрические
Плойка REMINGTON CI6325|0|Remington|||1099.0|1299.0|Приборы для укладки волос
Сменные электроды Beurer к EM 50 (4211125648497)|0|Beurer|||769.0|0.0|Массажеры
Насадка цилиндрический бор BEURER для MP 40/41|0|Beurer|||199.0|0.0|Насадки для фрезера
Мультистайлер Babyliss MS22E|0|BaByliss|||1099.0|0.0|Приборы для укладки волос
Сменные электроды Beurer Set 41/49/80/95 8 шт (4211125661021)|0|Beurer|||849.0|0.0|Массажеры
Эпилятор BRAUN Silk epil 9 SES 9/985 BS (81683683)|0|Braun|||5799.0|6799.0|Эпиляторы
Плойка Rowenta CF4310F0|0|Rowenta|||3299.0|0.0|Приборы для укладки волос
Сушилка для овощей и фруктов ROTEX RD540-W с сеткой для ягод|0|Rotex|||1329.0|1399.0|Сушилки для овощей и фруктов
Набор термостаканов PHILIPS 200 мл (4104517)|0|Philips|||499.0|499.0|Аксессуары для кухонной техники
Сменные электроды Beurer к EM 22 (4211125646622)|0|Beurer|||729.0|0.0|Массажеры
Насадка сапфировый конус BEURER для MP 40/41|0|Beurer|||199.0|0.0|Насадки для фрезера
Насадка сапфировый диск (мелкозернистый) BEURER для MP 40/41|0|Beurer|||199.0|0.0|Насадки для фрезера
Насадка сапфировый диск (крупнозернистый) BEURER для MP 40/41|0|Beurer|||199.0|0.0|Насадки для фрезера
Насадка войлоковый конус BEURER для MP 40/41|0|Beurer|||199.0|0.0|Насадки для фрезера
Утюг с парогенератором Philips PerfectCare Compact Plus GC7920/20|0|Philips|||5499.0|0.0|Утюги и гладильные системы
Фен PHILIPS DryCare Advanced BHD290/00|0|Philips|||1399.0|1399.0|Фены
Весы кухонные BEURER DS 61|0|Beurer|||2099.0|0.0|Весы кухонные
Швейная машина JANOME 3112M|0|Janome|||3590.0|3889.0|Швейные машинки
Машинка для стрижки волос WAHL Li EU black (1661.0465)|0|Wahl|||2499.0|2999.0|Машинки для стрижки
Электробритва-станок Xiaomi MSN Meisen T3 Multifunctional Shaver Black|0|Xiaomi|||794.0|790.0|Электробритвы
Набор для стрижки BRAUN BeardTrimmer BT3042 + Gillette Fusion ProGlide|0|Braun|||1189.0|1399.0|Триммеры
Эпилятор BRAUN Silk epil 9 SES 9/990 SensoSmart|0|Braun|||5299.0|6299.0|Эпиляторы
Ингалятор OROMED ORO-FAMILY PLUS|0|Oromed|||1220.0|0.0|Ингаляторы
Эпилятор BRAUN Silk epil 9 SES 9002 3D|0|Braun|||4299.0|6199.0|Эпиляторы
Утюг с парогенератором TEFAL EXPRESS ANTI-CALC SV8055E0|0|Tefal|||5599.0|6599.0|Утюги и гладильные системы
Электробритва BRAUN Series 9 9385 CC|0|Braun|||12999.0|12999.0|Электробритвы
Триммер-стайлер-бритва PHILIPS OneBlade Pro QP6520/20|0|Philips|||2699.0|3499.0|Триммеры
Смарт-весы BEURER BF 720|0|Beurer|||1989.0|2219.0|Весы напольные
Электрическая печь VINIS VO-6021B|0|Vinis|||2590.0|0.0|Электрические печи
Машинка для стрижки волос VITEK VT-2574|0|Vitek|||379.0|499.0|Машинки для стрижки
Соковыжималка центробежная GORENJE JC900E|0|Gorenje|||2349.0|0.0|Соковыжималки
Электробритва BRAUN Series 9 MBS9 MaxBraun (TYPE 5793 100лет)|0|Braun|||8999.0|12199.0|Электробритвы
Весы напольные ARDESTO SCB-965TRAVEL|0|Ardesto|||289.0|289.0|Весы напольные
Термобигуди REMINGTON KF40E|0|Remington|||1399.0|1899.0|Приборы для укладки волос
Утюг с парогенератором TEFAL Express Protect SV 9201|0|Tefal|||6999.0|7499.0|Утюги и гладильные системы
Триммер POLARIS PHC 0303RB|0|Polaris|||979.0|1299.0|Триммеры
Фен BRAUN HD 180|0|Braun|||849.0|849.0|Фены
Эпилятор BRAUN Silk epil 9 SES 9010 3D|0|Braun|||5859.0|6899.0|Эпиляторы
Швейная машина JANOME 3112R|0|Janome|||3590.0|3690.0|Швейные машинки
Аккумуляторный пылесос ROWENTA X-FORCE 11.60 ANIMAL KIT RH9879|0|Rowenta|||10999.0|13999.0|Аккумуляторные пылесосы
Утюг с парогенератором PHILIPS PerfectCare Expert Plus GC8942/20|0|Philips|||6999.0|8999.0|Утюги и гладильные системы
Весы напольные SCARLETT SC-BS33E060|0|Scarlett|||259.0|299.0|Весы напольные
Эпилятор BRAUN Silk epil 9 SES 9030 3D|0|Braun|||5859.0|6899.0|Эпиляторы
Электробритва BRAUN Series 5 50-W1200s BLACK/WHITE|0|Braun|||3499.0|3499.0|Электробритвы
Триммер универсальный PANASONIC ER-GC71-S520|0|Panasonic|||2199.0|2199.0|Триммеры
Весы кухонные BEURER KS 36|0|Beurer|||1589.0|0.0|Весы кухонные
Аккумуляторный пылесос Dyson V11 Absolute Extra|0|Dyson|||22990.0|0.0|Аккумуляторные пылесосы
Фен-щетка BaByliss AS121E|0|BaByliss|||1199.0|1499.0|Приборы для укладки волос
Кофеварка эспрессо ARDESTO ECM-E10B|0|Ardesto|||2275.0|2799.0|Кофеварки
Ирригатор B.Well WI-911|0|B.Well|||1490.0|1590.0|Зубные щетки и ирригаторы
Щипцы для волос REMINGTON S3580 гофре|0|Remington|||899.0|1199.0|Приборы для укладки волос
Щипцы для волос Polaris PHSS 2595TAi Argan Therapy PRO|0|Polaris|||999.0|1499.0|Приборы для укладки волос
Машинка для стрижки волос Babyliss E977E|0|BaByliss|||1499.0|1999.0|Машинки для стрижки
Щипцы для волос REMINGTON Curl&Straight Confidence S6606|0|Remington|||2399.0|2699.0|Приборы для укладки волос
Триммер универсальный PANASONIC ER-GB80-S520|0|Panasonic|||2399.0|2399.0|Триммеры
Эпилятор PHILIPS Satinelle Essential BRP533/00|0|Philips|||1699.0|2099.0|Эпиляторы
Электробритва BRAUN Series 1 150|0|Braun|||1549.0|1549.0|Электробритвы
Утюг Russell Hobbs Copper Express 23975-56|0|Russell Hobbs|||899.0|1549.0|Утюги и гладильные системы
Щипцы для волос Polaris PHSZ 1309TAi Argan Therapy PRO прикорневой объем|0|Polaris|||999.0|1499.0|Приборы для укладки волос
Плойка POLARIS PHS 2510K Red|0|Polaris|||499.0|759.0|Приборы для укладки волос
Фен-щетка BaByliss AS950E|0|BaByliss|||1999.0|0.0|Приборы для укладки волос
Плойка Polaris PHS 2513K|0|Polaris|||399.0|499.0|Приборы для укладки волос
Электрическая зубная щетка PANASONIC EW-DL82-W820|0|Panasonic|||2999.0|0.0|Зубные щетки и ирригаторы
Плойка Esperanza Hair Curler EBL007|0|Esperanza|||179.0|229.0|Приборы для укладки волос
Машинка для стрижки волос Xiaomi ENCHEN Boost Black|0|Xiaomi|||499.0|699.0|Машинки для стрижки
Электробритва-триммер BRAUN Series 5 50-B4650cs BLACK/BLUE|0|Braun|||4899.0|4899.0|Электробритвы
Триммер REMINGTON NE3870|0|Remington|||499.0|819.0|Триммеры
Утюг с парогенератором Braun Care Style Compact IS 2044 Mini|0|Braun|||3199.0|4699.0|Утюги и гладильные системы
Весы напольные BEURER GS 203 (Wood)|0|Beurer|||698.0|899.0|Весы напольные
Электрическая печь VENTOLUX KARINA|0|Ventolux|||2205.0|0.0|Электрические печи
Швейная машина JANOME Quality Fashion 7900|0|Janome|Тип: Компьютеризированная. Тип челнока: горизонтальный. Количество швейных операций: 100. Количество типов строчек: 100. Вариант выполнение петли: автомат. Мощность: 35 Вт.||10990.0|0.0|Швейные машинки
